{
  "source_file": "/home/shyam/aakhar/pm/Running-project-sheet.xlsx",
  "sheet": "Sheet1",
  "row_count": 33,
  "columns": [
    "Current Status",
    "Tender Ref. No. / NIT & Date",
    "EMD/tender fee Online /Exempted as per MSME bidder",
    "EMD /online payment received status",
    "HR required data for HR clearance RA bill realeased",
    "Policy Expired dt./renewal if any",
    "Labour License No./date of reg. & expired dt. /BOCW if any",
    "Status of PF/ESIC pending amount for HR clearance Running bills",
    "Job Allocation No. (JAN)",
    "EIC at Aakar",
    "Client Name",
    "State",
    "Place / City",
    "Name of Work",
    "PO/WO/LOA Details",
    "Financial Year",
    "PO/WO/LOA Date",
    "Work Start Date",
    "Completion Date as per LOA/PO",
    "Latest Work Completion Date (as per Time Extension)",
    "Completion Date as per Finla Time Extension / Deviation",
    "Client Billing Address",
    "Name of Authorised Person At Client",
    "Designation of Authorised Person At Client",
    "Mobile No. of Authorised Person At Client",
    "Email of Authorised Person At Client",
    "Email CC (Client)/C&M",
    "Contract Value Version as per LOI/NOA/LOA/DLOA/PO GST Extra",
    "GST Extra /Including",
    "Updated Contract Value GST Extra",
    "Bank Guarantee Submitted / CPG Not Submitted",
    "Bank Guarantee Value",
    "Bank Guaratee Expiry Date",
    "Bank Guaratee Expiry Date (Claim)",
    "Client WO/PO Upload LINK",
    "Client contract agreement LINK",
    "1st Sub Contractor's Name",
    "Proprietor / Auth. Signatory of Sub-Cont.",
    "Mobile No. of Sub-Cont. Proprietor / Auth. Signatory's",
    "Email of Sub-Cont. Proprietor / Auth. Signatory's",
    "GSTIN of Sub Contractor",
    "WO on % Party",
    "Work Order No.",
    "Work Order Date",
    "Sub-Contractor Work Order (Upload)"
  ],
  "rows": [
    {
      "Current Status": "work in stop due to fund ",
      "Tender Ref. No. / NIT & Date": "NTECL/C&M/NIT-143/CS-2726 \nquiry mail",
      "EMD/tender fee Online /Exempted as per MSME bidder": null,
      "EMD /online payment received status": null,
      "HR required data for HR clearance RA bill realeased": null,
      "Policy Expired dt./renewal if any": null,
      "Labour License No./date of reg. & expired dt. /BOCW if any": null,
      "Status of PF/ESIC pending amount for HR clearance Running bills": null,
      "Job Allocation No. (JAN)": 10005,
      "EIC at Aakar": "Monika Kochhar",
      "Client Name": "NTPC",
      "State": "Tamil Nadu",
      "Place / City": "Chennai",
      "Name of Work": "PCC Paving between Track Hopper I & II at Barh STPP.",
      "PO/WO/LOA Details": " LOA No.: NTECL/C&M/NIT-143/CS-2726 / LOA-2749 dated 11/10/2017",
      "Financial Year": "2017-18",
      "PO/WO/LOA Date": "2017-10-11",
      "Work Start Date": "2017-10-11",
      "Completion Date as per LOA/PO": "2018-06-11",
      "Latest Work Completion Date (as per Time Extension)": "2025-10-15",
      "Completion Date as per Finla Time Extension / Deviation": "NIL",
      "Client Billing Address": "NTPC Tamilnadu Energy Company Ltd. \nVallur Thermal Power Project, Vellivoyal Chavadi Post,\nPonneri Taluk, Thiruvallur\nDistrict  Chennai \n",
      "Name of Authorised Person At Client": "Sh. Vidhya Bhushan Kumar ",
      "Designation of Authorised Person At Client": "Deputy Manager ",
      "Mobile No. of Authorised Person At Client": 9948044458,
      "Email of Authorised Person At Client": "VBkumar01@ntpc.co.in",
      "Email CC (Client)/C&M": "parul@ntpc.co.in ",
      "Contract Value Version as per LOI/NOA/LOA/DLOA/PO GST Extra": 52231592,
      "GST Extra /Including": "18% Extra",
      "Updated Contract Value GST Extra": null,
      "Bank Guarantee Submitted / CPG Not Submitted": null,
      "Bank Guarantee Value": null,
      "Bank Guaratee Expiry Date": null,
      "Bank Guaratee Expiry Date (Claim)": null,
      "Client WO/PO Upload LINK": "https://drive.google.com/file/d/1gTnQD5_vaiDYrrKIKyX1tac-3VSji1c_/view?usp=sharing",
      "Client contract agreement LINK": "Not  Found in File",
      "1st Sub Contractor's Name": "Araan Constructions",
      "Proprietor / Auth. Signatory of Sub-Cont.": "Arun Kumar MS",
      "Mobile No. of Sub-Cont. Proprietor / Auth. Signatory's": 9445976751,
      "Email of Sub-Cont. Proprietor / Auth. Signatory's": "araanconstructions@yahoo.com",
      "GSTIN of Sub Contractor": "33AMDPA5733F1ZM",
      "WO on % Party": 0.07,
      "Work Order No.": "10005/12220058",
      "Work Order Date": "2022-04-05",
      "Sub-Contractor Work Order (Upload)": "https://drive.google.com/file/d/1Uoles7nM3GO1azbccZT0KSQQ_aLxRx4n/view?usp=sharing"
    },
    {
      "Current Status": "A5 | Works in Progress Appropriately",
      "Tender Ref. No. / NIT & Date": "NIT / Spec. Ref. No.  RPT-HVDC/C&M/WC-135/NIT-016(E)/2021, RFX 5002001670\n",
      "EMD/tender fee Online /Exempted as per MSME bidder": null,
      "EMD /online payment received status": null,
      "HR required data for HR clearance RA bill realeased": null,
      "Policy Expired dt./renewal if any": null,
      "Labour License No./date of reg. & expired dt. /BOCW if any": null,
      "Status of PF/ESIC pending amount for HR clearance Running bills": null,
      "Job Allocation No. (JAN)": 10053,
      "EIC at Aakar": "IRAM_Manpreet Kaur",
      "Client Name": "PGCIL",
      "State": null,
      "Place / City": "Thrissur",
      "Name of Work": "Construction of Community Centre at Thrissur.",
      "PO/WO/LOA Details": "LOA No. RPT/HVDC/C&M/WC-135/LOA-241 Dt. 11/5/2021\nSAP.O. Number : 6900010896",
      "Financial Year": "2021-22",
      "PO/WO/LOA Date": "2021-05-11",
      "Work Start Date": null,
      "Completion Date as per LOA/PO": "2021-12-08",
      "Latest Work Completion Date (as per Time Extension)": "2025-10-31",
      "Completion Date as per Finla Time Extension / Deviation": null,
      "Client Billing Address": "The Engineer In-Charge\nChief General Manager\nPOWER GRID CORPORATION OF INDIA LTD\n±320KV, HVDC Terminal Station, \nKAU Campus, Vellanikara Post, Thrissur, Kerala\n",
      "Name of Authorised Person At Client": "Shri P.P. Jayachandran",
      "Designation of Authorised Person At Client": "Deputy General Manager",
      "Mobile No. of Authorised Person At Client": "9074356272\n8826697153",
      "Email of Authorised Person At Client": "hvdc.thrissur@powergrid.co.in \nppjayachandran@powergrid.in",
      "Email CC (Client)/C&M": "supriya_tv@powergrid.in",
      "Contract Value Version as per LOI/NOA/LOA/DLOA/PO GST Extra": 30933410,
      "GST Extra /Including": null,
      "Updated Contract Value GST Extra": "3,40,32,723\nInclusive GST",
      "Bank Guarantee Submitted / CPG Not Submitted": "@ 3% shall be deducted towards\nSecurity Deposit from Running Bills on pro-rata basis.",
      "Bank Guarantee Value": null,
      "Bank Guaratee Expiry Date": null,
      "Bank Guaratee Expiry Date (Claim)": null,
      "Client WO/PO Upload LINK": "https://drive.google.com/drive/folders/18OWnUOZ23EwaI3ikyCOf4Xst4pk7jirT?usp=sharing; \nhttps://drive.google.com/file/d/1HoCZ7xAgmBc80YKaoblGUdUpkVeT7fqb/view?usp=sharing",
      "Client contract agreement LINK": "https://drive.google.com/file/d/1Ep4yaLlJps1WK_MjZ6JBLKvG8I1cUNBn/view?usp=sharing",
      "1st Sub Contractor's Name": "RK ENGINEERS & CONTRACTORS\n\nM/s COCHIN ENGINEERING PROJECT INDIA PRIVATE LIMITED",
      "Proprietor / Auth. Signatory of Sub-Cont.": "RISHIKESH RADHAKRISHNAN\n\nShri Umesh Manickan  SALEENA UMESH ",
      "Mobile No. of Sub-Cont. Proprietor / Auth. Signatory's": "8129797634  , 8943031000",
      "Email of Sub-Cont. Proprietor / Auth. Signatory's": "rishikeshr349@gmail.com",
      "GSTIN of Sub Contractor": "32DRQPR8682K1ZS\n\n32AALCC7219FIZT",
      "WO on % Party": "11.5%\n\n05%",
      "Work Order No.": "12220060   \n12420126",
      "Work Order Date": "14/05/2022\n19-06-2024",
      "Sub-Contractor Work Order (Upload)": "https://drive.google.com/file/d/1ct-6eDqCZdIy_MK4Lq-_lLIepRnndS6S/view?usp=sharing"
    },
    {
      "Current Status": "work in stop due to fund ",
      "Tender Ref. No. / NIT & Date": "Tender Reference Number NTPC/KBUNL/9900223549\nTender ID 2021_KBUNL_52938_1  ",
      "EMD/tender fee Online /Exempted as per MSME bidder": "  Bid Security Declaration against EMD",
      "EMD /online payment received status": null,
      "HR required data for HR clearance RA bill realeased": null,
      "Policy Expired dt./renewal if any": null,
      "Labour License No./date of reg. & expired dt. /BOCW if any": null,
      "Status of PF/ESIC pending amount for HR clearance Running bills": null,
      "Job Allocation No. (JAN)": 10071,
      "EIC at Aakar": "Monika Kochhar",
      "Client Name": "NTPC",
      "State": "Bihar",
      "Place / City": "Kanti",
      "Name of Work": "Construction of drains all around Coal Stock Pile, Coal slurry settling pond system, Coal\nDecanted Sump & Pump House at CHP Area at KBUNL, Kanti.",
      "PO/WO/LOA Details": "Purchase Order No. : 4200057197-026-1087 Date : 13.09.2022 ( version : 1 Date : 19.11.2022 )\nKBUNL (Purchase Order No. : 5500039539-026-2040 Date : 31.12.2021\nRef. No.: LOI - 2040-026-9900223549 Date: 14.12.2021\n\n09 Months\nservice period shall be from 01.01.2022 to 30.09.2022",
      "Financial Year": "2021-22",
      "PO/WO/LOA Date": "2021-01-01",
      "Work Start Date": "2022-01-01",
      "Completion Date as per LOA/PO": "2022-09-30",
      "Latest Work Completion Date (as per Time Extension)": "2025-12-15",
      "Completion Date as per Finla Time Extension / Deviation": "NIL",
      "Client Billing Address": "NTPC Limited \n1087 Muzaffarpur Thermal Power Station\nPO Kanti, Distt. Muzaffarpur Muzaffarpur\nBihar\n843130\nIndia\n06223-267339\nInvoicing to be done on\nGST No. : 10AAACN0255D2ZC",
      "Name of Authorised Person At Client": "V K JAISWAL\nDGM(CCD)\nC. Karthik\n\nTransfer -Mahabir Singh Chauhan\n\nDipak Kumar Chaki\n\nManish Kumar Pandey",
      "Designation of Authorised Person At Client": "DGM(CCD)\nSr. Manager\n\nThe  HOD O&M Civil ",
      "Mobile No. of Authorised Person At Client": "\n\n9471001383\n7319941705\n9445002541\n\n\n9430036492\n",
      "Email of Authorised Person At Client": "VKJAISWAL03@NTPC.CO.IN;\nKARTHICKC@NTPC.CO.IN\n\n\nMSCHAUHAN@NTPC.CO.IN\n\ndipakkumarchaki@ntpc.co.in\n\nAVANISHKUMAR@NTPC.CO.IN\n\nmkpandey@ntpc.co.in",
      "Email CC (Client)/C&M": "dipakkumarchaki@ntpc.co.in;amritlalbediya@ntpc.co.in;rpgupta03@ntpc.co.in;swatantrakumar@ntpc.co.in;\nmkpandey@ntpc.co.in;ckyadav@ntpc.co.in",
      "Contract Value Version as per LOI/NOA/LOA/DLOA/PO GST Extra": 14361586.09,
      "GST Extra /Including": "18% Extra",
      "Updated Contract Value GST Extra": 17893493.04,
      "Bank Guarantee Submitted / CPG Not Submitted": 430847.58269999997,
      "Bank Guarantee Value": null,
      "Bank Guaratee Expiry Date": "bank guarantee cancelled ",
      "Bank Guaratee Expiry Date (Claim)": "BG Revocation canara bank ",
      "Client WO/PO Upload LINK": "https://drive.google.com/file/d/1DyfD8FX1Dl4yTv2fBhcP8bHIKhwyxipg/view?usp=sharing",
      "Client contract agreement LINK": "https://drive.google.com/file/d/1Nw5-gDoVvo37929E4uFaoLhYZ-GFaDf0/view?usp=sharing",
      "1st Sub Contractor's Name": "M/s KABIR INFRA",
      "Proprietor / Auth. Signatory of Sub-Cont.": "Mr. FAKHRUL HASAN ",
      "Mobile No. of Sub-Cont. Proprietor / Auth. Signatory's": 8757375705,
      "Email of Sub-Cont. Proprietor / Auth. Signatory's": "fakhrulhasancv428@gmail.com;  ",
      "GSTIN of Sub Contractor": "10ABCFK4223G1Z0",
      "WO on % Party": 0.05,
      "Work Order No.": 12520011,
      "Work Order Date": "2025-07-19",
      "Sub-Contractor Work Order (Upload)": "mail at 19-09-2025"
    },
    {
      "Current Status": "A5 | Works in Progress Appropriately",
      "Tender Ref. No. / NIT & Date": "Tender Reference Number \n NTPC/USSC-CPG1/9900227744 \n Tender ID 2021_NTPC_55729_1 \n Bank / UTR Number : IGAMLGVVD8",
      "EMD/tender fee Online /Exempted as per MSME bidder": "SBI Tender fee online 2655/- UTR Number :  IGAMLGVVD8 18/11/2021  ",
      "EMD /online payment received status": "  Bid Security Declaration against EMD",
      "HR required data for HR clearance RA bill realeased": null,
      "Policy Expired dt./renewal if any": null,
      "Labour License No./date of reg. & expired dt. /BOCW if any": null,
      "Status of PF/ESIC pending amount for HR clearance Running bills": null,
      "Job Allocation No. (JAN)": 10080,
      "EIC at Aakar": "Monika Kochhar",
      "Client Name": "`NTPC",
      "State": "Odisha",
      "Place / City": "Darlipalli",
      "Name of Work": "Construction of Two Nos. of Seepage \n Water Pump House at Ash Dyke \n Area at NTPC Darlipalli",
      "PO/WO/LOA Details": "Purchase Order No. :\n  5500040068-025-1041\n  Date : 04.03.2022\nversion : 1 Date : 11.03.2024",
      "Financial Year": "2022-23",
      "PO/WO/LOA Date": "2022-03-04",
      "Work Start Date": "2022-03-21",
      "Completion Date as per LOA/PO": "2023-09-20",
      "Latest Work Completion Date (as per Time Extension)": "2025-12-15",
      "Completion Date as per Finla Time Extension / Deviation": "NIL",
      "Client Billing Address": "NTPC Limited \n 1053 Darlipali STPP\n P.O. Darlipali Odisha Sundargarh\n Odisha\n 770072\n India\n 0771-2544505\n 0771- 2544550\n Invoicing to be done on\n GST No. : 21AAACN0255D1ZA",
      "Name of Authorised Person At Client": "Sh S. B. MANDAL AGM Civil Const Darlipalli \n \n  Sh Paresh Devdas Gajallewar AGM Civil Const Darlipalli",
      "Designation of Authorised Person At Client": "EIC. AGM\n Civil const /\n AGM Civil Const",
      "Mobile No. of Authorised Person At Client": "9404951638\n \n \n 9424209153/9337750052",
      "Email of Authorised Person At Client": "sbmandal@ntpc.co.in\n \n \n PDGAJALLEWAR@NTPC.CO.IN\n \n KBHARTI@NTPC.CO.IN",
      "Email CC (Client)/C&M": "PRISHANTPATHIK@NTPC.CO.IN;\n SOMANATHMOHANTY@NTPC.CO.IN;\n NISHANTBANSAL@NTPC.CO.IN;\n PDGAJALLEWAR@NTPC.CO.IN;AKSAMAIYAR@NTPC.CO.IN;SBMANDAL@NTPC.CO.IN, VISHALMATHUR@NTPC.CO.IN",
      "Contract Value Version as per LOI/NOA/LOA/DLOA/PO GST Extra": 14439617.32,
      "GST Extra /Including": "18% Extra",
      "Updated Contract Value GST Extra": 17705857.12,
      "Bank Guarantee Submitted / CPG Not Submitted": "SD deuct in RA bill",
      "Bank Guarantee Value": null,
      "Bank Guaratee Expiry Date": null,
      "Bank Guaratee Expiry Date (Claim)": null,
      "Client WO/PO Upload LINK": "https://drive.google.com/file/d/1kbBtN\n OJ6eEvzrm94XFBoPEfmZivqy\n xyb/view?usp=sharing",
      "Client contract agreement LINK": "https://drive.google.com/file/d/1kENFWDaXKPmVaD8ENy1IjksZnlnqFOkx/view?usp=sharing",
      "1st Sub Contractor's Name": "M/s GANESH SHARMA CONSTRUCTION",
      "Proprietor / Auth. Signatory of Sub-Cont.": "GANESH SHARMA ",
      "Mobile No. of Sub-Cont. Proprietor / Auth. Signatory's": 8435422224,
      "Email of Sub-Cont. Proprietor / Auth. Signatory's": "gsharma2060@yahoo.com",
      "GSTIN of Sub Contractor": "21BIDPS4583E1ZC",
      "WO on % Party": "04%",
      "Work Order No.": "03-10080-12520009 ",
      "Work Order Date": "2025-07-08",
      "Sub-Contractor Work Order (Upload)": "mail on 20-08-2025"
    },
    {
      "Current Status": "work in progress",
      "Tender Ref. No. / NIT & Date": "Tender Reference Number \nNTPC/USSC-CPG1/9900235227 \nTender ID 2022_NTPC_60692_1 ",
      "EMD/tender fee Online /Exempted as per MSME bidder": "EMD 202655/- Bank / UTR Number :  IGANFOLOX8 21-03-2022 ",
      "EMD /online payment received status": "Not received ",
      "HR required data for HR clearance RA bill realeased": null,
      "Policy Expired dt./renewal if any": null,
      "Labour License No./date of reg. & expired dt. /BOCW if any": null,
      "Status of PF/ESIC pending amount for HR clearance Running bills": null,
      "Job Allocation No. (JAN)": 10098,
      "EIC at Aakar": "Monika Kochhar",
      "Client Name": "NTPC",
      "State": "Karnataka",
      "Place / City": "Kudgi",
      "Name of Work": "Construction of RCC Culvert, Patrolling road \nand Diversion of BoundaryWall on west side of Plant Boundary at Kudgi STPP",
      "PO/WO/LOA Details": "Purchase Order No. : 5500041039-025-1041 Date : 29.07.2022 ( EMD online payment\n\nPurchase Order No. : 5500041039-025-1041 Date : 29.07.2022 ( version : 1 Date : 24.02.2025 )",
      "Financial Year": "2022-23",
      "PO/WO/LOA Date": "2022-07-29",
      "Work Start Date": "2022-08-30",
      "Completion Date as per LOA/PO": "2023-05-29",
      "Latest Work Completion Date (as per Time Extension)": "2025-09-30",
      "Completion Date as per Finla Time Extension / Deviation": "NIL",
      "Client Billing Address": "NTPC Limited \n1046 Kudgi Super Thermal Power Project\nBASAVANA BAGEWADI, BIJAPUR\nKarnataka\n586121\nIndia\n0771-2544505\n0771- 2544550\nInvoicing to be done on\nGST No. : 29AAACN0255D1ZU",
      "Name of Authorised Person At Client": "Manoj Kumar \n\nSandeep Venkatesh Talekar ( EIC",
      "Designation of Authorised Person At Client": "Sr. Manager \n\nDGM (CCD)",
      "Mobile No. of Authorised Person At Client": "9420491809\n\n09420491809",
      "Email of Authorised Person At Client": "tmanojkumar@ntpc.co.in ;SANDEEPTALEKAR@NTPC.CO.IN;sandeeptalekar@ntpc.co.in;kpurender@ntpc.co.in;",
      "Email CC (Client)/C&M": "saketsrivastava@ntpc.co.in",
      "Contract Value Version as per LOI/NOA/LOA/DLOA/PO GST Extra": 16944108.5,
      "GST Extra /Including": "18% Extra",
      "Updated Contract Value GST Extra": null,
      "Bank Guarantee Submitted / CPG Not Submitted": "CPG deduct in RA bill\n 508323.0",
      "Bank Guarantee Value": null,
      "Bank Guaratee Expiry Date": null,
      "Bank Guaratee Expiry Date (Claim)": null,
      "Client WO/PO Upload LINK": "https://drive.google.com/file/d/1QGzHprylti-b1I12xh-7M0qu-y680IkG/view?usp=sharing",
      "Client contract agreement LINK": "https://drive.google.com/file/d/1ckMbKpLvqmZywNaPo7fpAzzvSo6n0JiU/view?usp=sharing",
      "1st Sub Contractor's Name": "National Technology & Construction Company",
      "Proprietor / Auth. Signatory of Sub-Cont.": "Yashpal Rana",
      "Mobile No. of Sub-Cont. Proprietor / Auth. Signatory's": "+917090998906",
      "Email of Sub-Cont. Proprietor / Auth. Signatory's": "ysrana.aiepl@gmail.com;saleems640@gmail.com",
      "GSTIN of Sub Contractor": "29BKHPR0813G3Z2",
      "WO on % Party": 0.07,
      "Work Order No.": 12220077,
      "Work Order Date": "2022-08-08",
      "Sub-Contractor Work Order (Upload)": "https://drive.google.com/file/d/1CXdjcxE66Vl49X3pF8xz8jf4-jaLZsN8/view?usp=sharing"
    },
    {
      "Current Status": "A1 | Pending Works under Execution & are lagging due to Funds/Non Performance of Sub-Contractor",
      "Tender Ref. No. / NIT & Date": "SPECIFICATION NO. : WR2/NT/CIVIL/DOM/G01/22/00048, RFX NO : 5002002426\nIntegrity Pact Required  - No\nNot Authorized Tender\nPrice Opening Date: 03.01.2023 11 AM\nL1 Bidder",
      "EMD/tender fee Online /Exempted as per MSME bidder": null,
      "EMD /online payment received status": null,
      "HR required data for HR clearance RA bill realeased": null,
      "Policy Expired dt./renewal if any": null,
      "Labour License No./date of reg. & expired dt. /BOCW if any": null,
      "Status of PF/ESIC pending amount for HR clearance Running bills": null,
      "Job Allocation No. (JAN)": 10108,
      "EIC at Aakar": "IRAM",
      "Client Name": "PGCIL",
      "State": null,
      "Place / City": "Banaskantha (Radhanesda), Gujarat",
      "Name of Work": "Balance Works for Construction of Store Shed at 400/220 kV Banaskantha (Radhanesda) GIS Pooling Substation.",
      "PO/WO/LOA Details": "BLOA Ref. No. WR-II/C&M/SD/0162/Balance Works/Banaskantha/BLOA-162 Date: 11-01-2023\nDLOA Ref. NO. WR-II/C&M/SD/0162/Blance Works/Banaskantha/LOA-162 Date: 17-01-2023\nSAP PO no. 6900011753\n06 Months i.e. 11-01-2023 to 11-07-2023",
      "Financial Year": "2022-2023",
      "PO/WO/LOA Date": "2023-01-11",
      "Work Start Date": null,
      "Completion Date as per LOA/PO": "2023-08-31",
      "Latest Work Completion Date (as per Time Extension)": "2026-01-10",
      "Completion Date as per Finla Time Extension / Deviation": null,
      "Client Billing Address": "DGM (Banaskantha)\nPower Grid Corporation of India Limited\n765/400 KV Sub-station, Village-Mudetha,\nArnivada Road,\nDist : Banaskantha (Gujrat) - 385530\n\nAddress of Site:\nPower Grid Corporation of India Limited\n400/220 kV GIS Substation, Village: Khimanavas,\nTehsil: Vav, Dist: Banaskantha (Gujarat)\n385575\n",
      "Name of Authorised Person At Client": "Pankaj Kumar Gupta\nAbhishek Sharma, Asst Manager",
      "Designation of Authorised Person At Client": "DGM\nAsst Manager",
      "Mobile No. of Authorised Person At Client": "9425409756\n7724877834",
      "Email of Authorised Person At Client": "pankajkumatgupta@powergrid.in\nsharmaabhishek@powergrid.in",
      "Email CC (Client)/C&M": "S R Sharma {एस.आर. शर्मा} srsharma@powergrid.in",
      "Contract Value Version as per LOI/NOA/LOA/DLOA/PO GST Extra": 5661457.9,
      "GST Extra /Including": null,
      "Updated Contract Value GST Extra": "58,61,603.53",
      "Bank Guarantee Submitted / CPG Not Submitted": null,
      "Bank Guarantee Value": null,
      "Bank Guaratee Expiry Date": null,
      "Bank Guaratee Expiry Date (Claim)": null,
      "Client WO/PO Upload LINK": "https://drive.google.com/file/d/1V74nsftnBOz9jJD85NbOEcpo5buoYh_4/view?usp=sharing",
      "Client contract agreement LINK": "https://drive.google.com/file/d/1DRjOP3yVThdi_RS-QsSOTOmmURdAyz2d/view?usp=sharing",
      "1st Sub Contractor's Name": "M/s SHRI TARA CHANDRA CHETTRI\n\nM/s Jitendra S Vyas",
      "Proprietor / Auth. Signatory of Sub-Cont.": "SHRI TARA CHANDRA CHETTRI\n\nMr. Jitendrabhai Suryakantbhai Vyas ",
      "Mobile No. of Sub-Cont. Proprietor / Auth. Signatory's": "9198007 47637\n\n9409014459",
      "Email of Sub-Cont. Proprietor / Auth. Signatory's": "tara.namchi2099@gmail.com\n\njsvyas67@gmail.com",
      "GSTIN of Sub Contractor": " 11AHUPC4767D3ZE\n\n24ADRPV4352J1ZZ",
      "WO on % Party": "10%\n\n10%",
      "Work Order No.": "12320100\n\n12520021",
      "Work Order Date": "13-April-2023\n\n05-12-2025",
      "Sub-Contractor Work Order (Upload)": "https://drive.google.com/file/d/1dyuDcEXH-i4q7MsKCJ1OjepfJNFVjZHm/view?usp=share_link\n\nhttps://drive.google.com/file/d/1rvzvQYKiWGY7L0-uypwq6TATNvdSCh1A/view?usp=sharing\n\n"
    },
    {
      "Current Status": "A5 | Works in Progress Appropriately",
      "Tender Ref. No. / NIT & Date": "Specification No: SR1/NT/W-CIVIL/DOM/B00/23/01750/WC-3127/RFx-5002002710 \nIntegrity Pact Required: Yes\nPrice Opening has been scheduled on 25.05.2023 / 11:30:00 \nPrice open L1",
      "EMD/tender fee Online /Exempted as per MSME bidder": "BG deducted from RA BILLS",
      "EMD /online payment received status": null,
      "HR required data for HR clearance RA bill realeased": null,
      "Policy Expired dt./renewal if any": null,
      "Labour License No./date of reg. & expired dt. /BOCW if any": null,
      "Status of PF/ESIC pending amount for HR clearance Running bills": null,
      "Job Allocation No. (JAN)": 10113,
      "EIC at Aakar": "IRAM ",
      "Client Name": "PGCIL",
      "State": null,
      "Place / City": "Vijayawada Substation, Andhra Pradesh",
      "Name of Work": "Civil works package for conversion of Conventional C&R Panels to Bay Kiosk (SPR) based protection system at 400kV Vijayawada Substation under ADD-CAP 2019-24.",
      "PO/WO/LOA Details": "LOA Ref. No. SR-I/C&M/WC-3127/LOA-3215/2023/CNMO- 114013/023 Date: 06-07-2023, SAP PO No. 6400009830\n12 Months i.e.  06-07-2023 to 06-07-2024",
      "Financial Year": "2022-2023",
      "PO/WO/LOA Date": "2023-07-06",
      "Work Start Date": "2023-08-26",
      "Completion Date as per LOA/PO": "2024-07-06",
      "Latest Work Completion Date (as per Time Extension)": "2025-12-31",
      "Completion Date as per Finla Time Extension / Deviation": null,
      "Client Billing Address": "POWER GRID CORPN. OF INDIA LTD.\nNUZVID ROAD, NUNNA POST\nVIJAYAWADA 400 KV SUBSTATION VIJAYAWADA - 521212, AP,08539-286788\nGST: 37AAACP0252G1ZS\n",
      "Name of Authorised Person At Client": "Contact: Sh. K Nagamohana Rao, Sr. GM, 9717296922",
      "Designation of Authorised Person At Client": "Sr. GM, ",
      "Mobile No. of Authorised Person At Client": 9717296922,
      "Email of Authorised Person At Client": null,
      "Email CC (Client)/C&M": null,
      "Contract Value Version as per LOI/NOA/LOA/DLOA/PO GST Extra": 21779710,
      "GST Extra /Including": null,
      "Updated Contract Value GST Extra": null,
      "Bank Guarantee Submitted / CPG Not Submitted": null,
      "Bank Guarantee Value": "7863-01-29",
      "Bank Guaratee Expiry Date": null,
      "Bank Guaratee Expiry Date (Claim)": null,
      "Client WO/PO Upload LINK": "TERMINATE",
      "Client contract agreement LINK": "https://drive.google.com/file/d/1MHuD3mBAMmBpPKeVVyEy9Ui8_2oOWVx_/view?usp=sharing",
      "1st Sub Contractor's Name": "M/s BASUKI CONSTRUCTION",
      "Proprietor / Auth. Signatory of Sub-Cont.": "Mr. Rajeev Ranjan Mishra",
      "Mobile No. of Sub-Cont. Proprietor / Auth. Signatory's": "09006004031 / 09939387243",
      "Email of Sub-Cont. Proprietor / Auth. Signatory's": "pcarajeev@gmail.com",
      "GSTIN of Sub Contractor": "10AZLPM7685H1Z1",
      "WO on % Party": 0.09,
      "Work Order No.": "10113/12320113",
      "Work Order Date": "2023-07-29",
      "Sub-Contractor Work Order (Upload)": "https://drive.google.com/file/d/1O-Ojox9i867qNtrBn3IVmZLTezSIWJhT/view?usp=sharing"
    },
    {
      "Current Status": "A5 | Works in Progress Appropriately",
      "Tender Ref. No. / NIT & Date": "Specification No.: ODP/BB/C&M-3592/OT-26/RFx No. 5002003305/23-24\nIntegrity Pact Required - Yes\nQuery dt 18-05-2024 to be submitted upto 20-05-2024\nPrice Opening Date: 03.06.2024 10:12:00",
      "EMD/tender fee Online /Exempted as per MSME bidder": null,
      "EMD /online payment received status": null,
      "HR required data for HR clearance RA bill realeased": null,
      "Policy Expired dt./renewal if any": null,
      "Labour License No./date of reg. & expired dt. /BOCW if any": null,
      "Status of PF/ESIC pending amount for HR clearance Running bills": null,
      "Job Allocation No. (JAN)": 10122,
      "EIC at Aakar": "IRAM ",
      "Client Name": "PGCIL",
      "State": null,
      "Place / City": "Odisha",
      "Name of Work": "Package: Construction of boundary wall for setting of one new Govt.  Industrial Training Institute  at Dharamgarh Sub division of Kalahandi District under POWERGRID, Odisha Projects. (Under CSR Budget).",
      "PO/WO/LOA Details": "LOA Ref. No. ODP/BB/C&M-3592/OT-26/LOA-56/24-25 Date: 06-06-2024\nSAP Po no.: 4100006666\nSix Months i.e. 06-06-2024 to 05-12-2024",
      "Financial Year": "2024-2025",
      "PO/WO/LOA Date": "2024-06-06",
      "Work Start Date": null,
      "Completion Date as per LOA/PO": "2024-12-05",
      "Latest Work Completion Date (as per Time Extension)": "2026-01-31",
      "Completion Date as per Finla Time Extension / Deviation": null,
      "Client Billing Address": "The  Chief Manager, Power Grid Corporation of India Ltd. 400/220 KV Indravati  Sub-Station ,PO: Mukhiguda, Dist: Kalahandi ,Odisha-766026.",
      "Name of Authorised Person At Client": "Mr. Sanjay Chaki\nMr. Umakanta Shukla \nMr. Brajesh baraik\nMr. Rajat Jena",
      "Designation of Authorised Person At Client": "DGM\nChief Manager\nEngineer\nJ.E. Civil`",
      "Mobile No. of Authorised Person At Client": "09078883612\n08917567285\n08003492932\n07381868892",
      "Email of Authorised Person At Client": "skchakki@powergrid.in\numakantashukla@powergrid.in\nbrajeshbaraik@powergrid.in\nrajat7jena@powergrid.in",
      "Email CC (Client)/C&M": null,
      "Contract Value Version as per LOI/NOA/LOA/DLOA/PO GST Extra": 13755408,
      "GST Extra /Including": null,
      "Updated Contract Value GST Extra": null,
      "Bank Guarantee Submitted / CPG Not Submitted": null,
      "Bank Guarantee Value": null,
      "Bank Guaratee Expiry Date": null,
      "Bank Guaratee Expiry Date (Claim)": null,
      "Client WO/PO Upload LINK": "https://drive.google.com/file/d/1Z4tj4MOOIchrtJoe0C2RjUnaEkeLKj5n/view?usp=sharing",
      "Client contract agreement LINK": null,
      "1st Sub Contractor's Name": "M/s JMB CONSTRUCTION",
      "Proprietor / Auth. Signatory of Sub-Cont.": "Mr. pramod kumar jena\n",
      "Mobile No. of Sub-Cont. Proprietor / Auth. Signatory's": "91+7978611952",
      "Email of Sub-Cont. Proprietor / Auth. Signatory's": "pramodjena02@gmail.com",
      "GSTIN of Sub Contractor": "21AEOPJ8470M2Z0",
      "WO on % Party": "10%",
      "Work Order No.": "10122-12420125 amend 1",
      "Work Order Date": "2025-09-16",
      "Sub-Contractor Work Order (Upload)": null
    },
    {
      "Current Status": "A5 | Works in Progress Appropriately",
      "Tender Ref. No. / NIT & Date": "24233 \n SPECIFICATION NO.: NR3/NT/S-MISC/DOM/K00/24/08278, RFx: 5002003617\n Integrity Pact Required: No\n Link has Enable\n File pending\n Will submit By Akhil\n Price Opening Date: 24.07.2024 16:36:00\n Award on 31-07-2024",
      "EMD/tender fee Online /Exempted as per MSME bidder": null,
      "EMD /online payment received status": null,
      "HR required data for HR clearance RA bill realeased": null,
      "Policy Expired dt./renewal if any": null,
      "Labour License No./date of reg. & expired dt. /BOCW if any": null,
      "Status of PF/ESIC pending amount for HR clearance Running bills": null,
      "Job Allocation No. (JAN)": 10124,
      "EIC at Aakar": "IRAM ",
      "Client Name": "PGCIL",
      "State": null,
      "Place / City": "KANPUR (U.P)",
      "Name of Work": "Civil works for Retrofit of existing conventional control and protection system with new IEC 61850 based SAS at 400kV Kanpur Substation.",
      "PO/WO/LOA Details": "LOA Ref. No.: NR-II/C&M/KO0/2024/5002003617/400kV Kanpur/36629 dated 31.07.2024 \nSAP PO No.: 4100006458\n 8 (Eight) Months i.e. 31-07-2024 to 31-03-2025",
      "Financial Year": "2024-2025",
      "PO/WO/LOA Date": "2024-07-31",
      "Work Start Date": "2024-10-05",
      "Completion Date as per LOA/PO": "2025-03-31",
      "Latest Work Completion Date (as per Time Extension)": "2025-12-31",
      "Completion Date as per Finla Time Extension / Deviation": null,
      "Client Billing Address": "Power Grid Corporation of India Limited\n 400/220 kV Sub-Station,\n Kalpi Road, Village-Bhauti,\n PO: Chakarpur,\n Dist: Kanpur- 209305\n Uttar Pradesh",
      "Name of Authorised Person At Client": "S.M. Pandey",
      "Designation of Authorised Person At Client": "DGM",
      "Mobile No. of Authorised Person At Client": 8004910703,
      "Email of Authorised Person At Client": "sm.pandey@powergrid.in",
      "Email CC (Client)/C&M": "S M Pandey | Dy. General Manager | 8004910703 | sm.pandey@powergrid.in",
      "Contract Value Version as per LOI/NOA/LOA/DLOA/PO GST Extra": "₹ 25,96,197.77",
      "GST Extra /Including": "18% GST Extra",
      "Updated Contract Value GST Extra": null,
      "Bank Guarantee Submitted / CPG Not Submitted": "May be submitted OR may be Deducted from our RA bill as per clause No. 18.6.1 (SCC)",
      "Bank Guarantee Value": "₹ 2,59,620.00",
      "Bank Guaratee Expiry Date": "2026-06-30",
      "Bank Guaratee Expiry Date (Claim)": "2026-09-30",
      "Client WO/PO Upload LINK": "https://drive.google.com/file/d/1lzKO-4Gyurc9VtR3Dq4iccSJXQUMwbv8/view?usp=sharing",
      "Client contract agreement LINK": "https://drive.google.com/file/d/1nHFcui78oQfEKacrxaM8gMkDnbfD0MT4/view?usp=sharing",
      "1st Sub Contractor's Name": "M/s RAGHAVAJIT CONSTRUCTION PRIVATE LIMITED",
      "Proprietor / Auth. Signatory of Sub-Cont.": "Mr.  ARUN SINGH ",
      "Mobile No. of Sub-Cont. Proprietor / Auth. Signatory's": "91+9532450230",
      "Email of Sub-Cont. Proprietor / Auth. Signatory's": "neerajknp8090@gmail.com\narunsingh0100@gmail.com",
      "GSTIN of Sub Contractor": "09AANCR6103P1ZR",
      "WO on % Party": 0.1,
      "Work Order No.": "03-10124-12420144",
      "Work Order Date": "2025-01-18",
      "Sub-Contractor Work Order (Upload)": "https://drive.google.com/file/d/1E5Gi3AycUyIBhDNzsETf9qJqX38VZOPr/view?usp=sharing"
    },
    {
      "Current Status": "A5 | Works in Progress Appropriately",
      "Tender Ref. No. / NIT & Date": "24212 \n SPECIFICATION NO.: NR3/NT/W-CIVIL/DOM/K00/24/08300 (RFx 5002003620) \n Integrity Pact Required: Yes\n Link has Enable\n File pending\n Query dt 17-07-2024\n Award Letter dt 16-08-2024",
      "EMD/tender fee Online /Exempted as per MSME bidder": null,
      "EMD /online payment received status": null,
      "HR required data for HR clearance RA bill realeased": null,
      "Policy Expired dt./renewal if any": null,
      "Labour License No./date of reg. & expired dt. /BOCW if any": null,
      "Status of PF/ESIC pending amount for HR clearance Running bills": null,
      "Job Allocation No. (JAN)": 10125,
      "EIC at Aakar": "IRAM ",
      "Client Name": "PGCIL",
      "State": null,
      "Place / City": "Allahabad Substation, Uttar Pardesh",
      "Name of Work": "Part A Civil Works for 400/220 kV Allahabad Substation Extension (SS-119).",
      "PO/WO/LOA Details": "NOA Ref. No.: NR-IIIC&M/2024/5002003620/NOA/24-110460/01/36765 dt 16-08-2024\nSAP PO 4100006492, 4100006493\n 06 Months i.e. 16-08-2024 to 15-02-2025",
      "Financial Year": "2024-2025",
      "PO/WO/LOA Date": "2024-08-16",
      "Work Start Date": "2024-09-29",
      "Completion Date as per LOA/PO": "2025-02-15",
      "Latest Work Completion Date (as per Time Extension)": "2025-12-31",
      "Completion Date as per Finla Time Extension / Deviation": null,
      "Client Billing Address": "Location of Work:\n400kV Allahabad Sub-station Vill: Sarangapur, Post: Dandupur, Rewa Road, Prayagraj, Uttar Pradesh-211008",
      "Name of Authorised Person At Client": "Peeyush Pandey",
      "Designation of Authorised Person At Client": "(Sr. DGM)",
      "Mobile No. of Authorised Person At Client": 8004912062,
      "Email of Authorised Person At Client": "peeyushpandey@powergrid.in",
      "Email CC (Client)/C&M": "Pallavi Mishra | Chief Mgr (C&M) | pallavi.mishra@powergrid.in | 9560890343",
      "Contract Value Version as per LOI/NOA/LOA/DLOA/PO GST Extra": "₹ 3,08,22,670.00",
      "GST Extra /Including": "18% GST Extra",
      "Updated Contract Value GST Extra": null,
      "Bank Guarantee Submitted / CPG Not Submitted": "May be submitted OR may be Deducted from our RA bill",
      "Bank Guarantee Value": "₹ 30,82,267.00",
      "Bank Guaratee Expiry Date": "2026-05-15",
      "Bank Guaratee Expiry Date (Claim)": "2026-08-15",
      "Client WO/PO Upload LINK": "https://drive.google.com/drive/folders/1nRhARy0Gzg_mdCIr7dQkvH-vYQGm3AeE",
      "Client contract agreement LINK": "https://drive.google.com/file/d/1DcNxa7X_i_IZAe-Kd7eNzuYVMMZXHK9m/view?usp=sharing",
      "1st Sub Contractor's Name": "M/s KABIR INFRA",
      "Proprietor / Auth. Signatory of Sub-Cont.": "Mr.  FAKHRUL HASAN ",
      "Mobile No. of Sub-Cont. Proprietor / Auth. Signatory's": 8757375705,
      "Email of Sub-Cont. Proprietor / Auth. Signatory's": "fakhrulhasan@kabirinfra.co.in\npawanpandey@kabirinfra.co.in\n\nfakhrulhasancv428@gmail.com;  ",
      "GSTIN of Sub Contractor": "10ABCFK4223G1Z0",
      "WO on % Party": 4,
      "Work Order No.": "02-10125-12520008",
      "Work Order Date": "2025-06-18",
      "Sub-Contractor Work Order (Upload)": "https://drive.google.com/file/d/1xXOP85996uETHAazzTmW1wYAA_FNJfbU/view?usp=sharing"
    },
    {
      "Current Status": "A5 | Works in Progress Appropriately",
      "Tender Ref. No. / NIT & Date": "GEM/2024/B/5068478\nBidding Document Number: 9900282698",
      "EMD/tender fee Online /Exempted as per MSME bidder": "Exempted ",
      "EMD /online payment received status": null,
      "HR required data for HR clearance RA bill realeased": null,
      "Policy Expired dt./renewal if any": null,
      "Labour License No./date of reg. & expired dt. /BOCW if any": null,
      "Status of PF/ESIC pending amount for HR clearance Running bills": null,
      "Job Allocation No. (JAN)": 10127,
      "EIC at Aakar": "Monika Kochhar",
      "Client Name": "NTPC",
      "State": "Maharashtra",
      "Place / City": "Solapur",
      "Name of Work": "Biennial maintenance of Horticulture works of Township RLI Main plant area for the\nyear 20242025 NTPC Solapur",
      "PO/WO/LOA Details": "Purchase Order No. : 4000343344-020-1041 Date : 30.09.2024\n\nContract No: GEMC-511687738285099 27/09/2024",
      "Financial Year": "2024-2025",
      "PO/WO/LOA Date": "30.09.2024",
      "Work Start Date": "2024-10-05",
      "Completion Date as per LOA/PO": "2026-10-04",
      "Latest Work Completion Date (as per Time Extension)": null,
      "Completion Date as per Finla Time Extension / Deviation": "NIL",
      "Client Billing Address": "NTPC Limited \n1045 Solapur STPP\nPO- HOTGI STATION SOUTH SOLAPUR, SOLAPUR\nMaharashtra\n413215\nIndia\n0771-2544505\n0771- 2544550\nInvoicing to be done on\nGST No. : 27AAACN0255D1ZY",
      "Name of Authorised Person At Client": "Mr. Satish kolluri\nMr. Venkata Krishna Rao",
      "Designation of Authorised Person At Client": "Sr. Manager TAD Civil\nDGM O&M",
      "Mobile No. of Authorised Person At Client": "94039 64663\n82628 49044\n9480486408",
      "Email of Authorised Person At Client": "satishkolluri@ntpc.co.in;deepakkumar12@ntpc.co.in\n\nvvkrao@ntpc.co.in;NVMSRAO@NTPC.CO.IN\nrkmswamy@ntpc.co.in; ",
      "Email CC (Client)/C&M": "kkarora@ntpc.co.in;",
      "Contract Value Version as per LOI/NOA/LOA/DLOA/PO GST Extra": 36757676.36,
      "GST Extra /Including": "18% GST Extra",
      "Updated Contract Value GST Extra": null,
      "Bank Guarantee Submitted / CPG Not Submitted": "SD deuct in RA bill",
      "Bank Guarantee Value": null,
      "Bank Guaratee Expiry Date": null,
      "Bank Guaratee Expiry Date (Claim)": null,
      "Client WO/PO Upload LINK": "https://drive.google.com/file/d/18Z7eyNlP_MNu3fQN1TRf6d94QopIcpWW/view?usp=sharing",
      "Client contract agreement LINK": "https://drive.google.com/file/d/17f5agKAHz4o8luTIzT7BvItUwtwfoSrz/view?usp=sharing",
      "1st Sub Contractor's Name": "M/s BRAJESH KUMAR ( WO not signed ",
      "Proprietor / Auth. Signatory of Sub-Cont.": "Mr. BRAJESH KUMAR",
      "Mobile No. of Sub-Cont. Proprietor / Auth. Signatory's": 9412203436,
      "Email of Sub-Cont. Proprietor / Auth. Signatory's": "heavensgarden10@gmail.com",
      "GSTIN of Sub Contractor": "09AIGPK2578M2ZN",
      "WO on % Party": "10% & Rs 5,00,000 SD",
      "Work Order No.": "10127-12420131",
      "Work Order Date": "2024-10-01",
      "Sub-Contractor Work Order (Upload)": "https://drive.google.com/file/d/1IBaXnvGPPcoxlAogxEt6jyjNRs7gIDg0/view?usp=sharing"
    },
    {
      "Current Status": "A5 | Works in Progress Appropriately",
      "Tender Ref. No. / NIT & Date": "24265\nSpecification No(s): WR-1/C&M/VRL/NIT-116/I-3401-2024/Rfx-5002003643\nIntegrity Pact Required: No\nLink is Enable\nQR only AEC\nOnly BOQ submitted by Manpreet Badesha\nBid Opening Statement\n",
      "EMD/tender fee Online /Exempted as per MSME bidder": null,
      "EMD /online payment received status": null,
      "HR required data for HR clearance RA bill realeased": null,
      "Policy Expired dt./renewal if any": null,
      "Labour License No./date of reg. & expired dt. /BOCW if any": null,
      "Status of PF/ESIC pending amount for HR clearance Running bills": null,
      "Job Allocation No. (JAN)": 10128,
      "EIC at Aakar": "IRAM ",
      "Client Name": "PGCIL",
      "State": null,
      "Place / City": "Raigarh, Chhattisgarh",
      "Name of Work": "Horticulture Development of the main entrance area at HVDC-Raigarh.",
      "PO/WO/LOA Details": "NOA Ref No: WR-1/C&M/VRL/NIT-116/1-3401-2024/NOA-1427/984 dt 27-09-2024, \nSAP PO:6900013302\n12 months i.e. 27-09-2024 to 27-09-2025",
      "Financial Year": "2024-2025",
      "PO/WO/LOA Date": "2024-09-27",
      "Work Start Date": null,
      "Completion Date as per LOA/PO": "2025-09-27",
      "Latest Work Completion Date (as per Time Extension)": "2026-03-31",
      "Completion Date as per Finla Time Extension / Deviation": null,
      "Client Billing Address": "The CGM, Raigarh, Power Grid Corporation of India Ltd, 11km Milstone, Nandeli Road, PO and Villege-Kotra, Distt- Raigarh-496001 (Chattisgarh) ",
      "Name of Authorised Person At Client": "Sheeja ",
      "Designation of Authorised Person At Client": "Ast Manager Civil",
      "Mobile No. of Authorised Person At Client": "6379589014 | 7042499401",
      "Email of Authorised Person At Client": "sheejas@powergrid.in>",
      "Email CC (Client)/C&M": "sumeetmishra@powergrid.in",
      "Contract Value Version as per LOI/NOA/LOA/DLOA/PO GST Extra": "₹ 58,70,096.83",
      "GST Extra /Including": "18% GST Extra",
      "Updated Contract Value GST Extra": null,
      "Bank Guarantee Submitted / CPG Not Submitted": "CPG 10% my be deducted from 1st RA bill as 1-5-SCC pge No. 06 (Clause No. GCC 8.2)",
      "Bank Guarantee Value": "₹ 58,70,09.683",
      "Bank Guaratee Expiry Date": null,
      "Bank Guaratee Expiry Date (Claim)": null,
      "Client WO/PO Upload LINK": "https://drive.google.com/file/d/1VnA9my8CBGzcuqt1yvGzJdj-U4-S0h8A/view?usp=sharing",
      "Client contract agreement LINK": "https://drive.google.com/file/d/1bdpVrP-EXeziwcQXbUB3V_7OM5DRH98b/view?usp=sharing\n\nhttps://drive.google.com/file/d/1bQZZvd5K6NN7GRT80sU1fL89Rtdi5FhD/view?usp=sharing",
      "1st Sub Contractor's Name": "M/s Shree Balaji Contractors & Suppliers",
      "Proprietor / Auth. Signatory of Sub-Cont.": ". Mr. SATVEER SINGH ",
      "Mobile No. of Sub-Cont. Proprietor / Auth. Signatory's": "91 94168 93740 |\n +91 98971 83650",
      "Email of Sub-Cont. Proprietor / Auth. Signatory's": "satveersorout2425@gmail.com | shreebalajicontractors1@gmail.com",
      "GSTIN of Sub Contractor": "09ADVFS1708H1ZM",
      "WO on % Party": "08%",
      "Work Order No.": "10128-12420145",
      "Work Order Date": "2025-01-23",
      "Sub-Contractor Work Order (Upload)": "https://drive.google.com/file/d/1UkY_ValX24syCW8urN7z5aBPiqQLwd15/view?usp=sharing"
    },
    {
      "Current Status": "A5 | Works in Progress Appropriately",
      "Tender Ref. No. / NIT & Date": "Single party Aakar Qualified\nTender Reference Number \nNTPC/USSC-CPG1/9900282646\nTender ID 2024_NTPC_88104_1",
      "EMD/tender fee Online /Exempted as per MSME bidder": "Exempted ",
      "EMD /online payment received status": null,
      "HR required data for HR clearance RA bill realeased": null,
      "Policy Expired dt./renewal if any": null,
      "Labour License No./date of reg. & expired dt. /BOCW if any": null,
      "Status of PF/ESIC pending amount for HR clearance Running bills": null,
      "Job Allocation No. (JAN)": 10129,
      "EIC at Aakar": "Monika Kochhar",
      "Client Name": "NTPC",
      "State": "Telangana",
      "Place / City": "Ramagundam",
      "Name of Work": "Transportation of Crushed coal between coal yards of RSTPS & TeSTPS and Internal transfer of uncrushed coal at TeSTPS by road.",
      "PO/WO/LOA Details": "Purchase Order No. : 4000342945-067-1041 Date : 27.09.2024",
      "Financial Year": "2024-2025",
      "PO/WO/LOA Date": "27.09.2024",
      "Work Start Date": "01.11.2024\nActual 25/03/2025",
      "Completion Date as per LOA/PO": "31.10.2025",
      "Latest Work Completion Date (as per Time Extension)": "30.04.2026",
      "Completion Date as per Finla Time Extension / Deviation": "NIL",
      "Client Billing Address": "NTPC Limited \n1057 Telangana STPP Station\nPO JYOTINAGAR DISTRICT PEDDAPALLI\nTelangana\n505215\nIndia\n0771-2544505\n0771- 2544550\nInvoicing to be done on\nGST No. : 36AAACN0255D1ZZ",
      "Name of Authorised Person At Client": "Sh.Hemant B. Shinde\nSh. Madhookar Reddy",
      "Designation of Authorised Person At Client": "AGM(FT)\nSr. Manager ",
      "Mobile No. of Authorised Person At Client": "9423192800\n7420062581",
      "Email of Authorised Person At Client": "hemantshinde@ntpc.co.in;\nSDDHOBLE@NTPC.CO.IN\nmadhookarreddy@ntpc.co.in ",
      "Email CC (Client)/C&M": "PUSHPAKASHYAP@NTPC.CO.IN;SDDHOBLE@NTPC.CO.IN;ARDASH@NTPC.CO.IN",
      "Contract Value Version as per LOI/NOA/LOA/DLOA/PO GST Extra": 14900000,
      "GST Extra /Including": "GST-ND @ 5.00 % Extra",
      "Updated Contract Value GST Extra": null,
      "Bank Guarantee Submitted / CPG Not Submitted": "SD deuct in RA bill",
      "Bank Guarantee Value": null,
      "Bank Guaratee Expiry Date": null,
      "Bank Guaratee Expiry Date (Claim)": null,
      "Client WO/PO Upload LINK": "https://drive.google.com/file/d/1cVDey8TSaN3Z3fHiZ7f3eFxPJ4JFSaPb/view?usp=sharing",
      "Client contract agreement LINK": "https://drive.google.com/file/d/1ew7mIAk9bof_fx_ARKxArQxCpXuWhJvB/view?usp=sharing",
      "1st Sub Contractor's Name": "M/S DBS Contractores",
      "Proprietor / Auth. Signatory of Sub-Cont.": "Sunil Boora",
      "Mobile No. of Sub-Cont. Proprietor / Auth. Signatory's": "91 92542100000",
      "Email of Sub-Cont. Proprietor / Auth. Signatory's": "boorasunil290@gmail.com;",
      "GSTIN of Sub Contractor": "06ANTPB1091L1ZS",
      "WO on % Party": 0.12,
      "Work Order No.": "Work Order No. 10129-12420132                                                       \n\n",
      "Work Order Date": "2024-10-04",
      "Sub-Contractor Work Order (Upload)": "https://drive.google.com/file/d/1mvIRxRPQrnr0WXnsmVunGg3EU5ONdLRa/view?usp=sharing"
    },
    {
      "Current Status": "A1 | Pending Works under Execution & are lagging due to Funds/Non Performance of Sub-Contractor",
      "Tender Ref. No. / NIT & Date": "24108  \nSpecification No: SR-I/C&M/WC-3658/2024/RFx-5002003561 \nIntegrity Pact Required - No\nLink is Enable\nFile Pending\nQuery dt 12-07-2024\nPrice Opening Date: 21.08.2024 15:00 AM",
      "EMD/tender fee Online /Exempted as per MSME bidder": null,
      "EMD /online payment received status": null,
      "HR required data for HR clearance RA bill realeased": null,
      "Policy Expired dt./renewal if any": null,
      "Labour License No./date of reg. & expired dt. /BOCW if any": null,
      "Status of PF/ESIC pending amount for HR clearance Running bills": null,
      "Job Allocation No. (JAN)": 10130,
      "EIC at Aakar": "IRAM ",
      "Client Name": "PGCIL",
      "State": null,
      "Place / City": "Nellore, Andhra Pradesh",
      "Name of Work": "AMC-II for De-Weeding, Grass Cutting and Jungle Clearance at Nellore Pooling Station.\n",
      "PO/WO/LOA Details": "LOA Ref. No. : SR-1/C&M/WC-3658/LOA-  3898/2024 dt 30-09-2024\n02 Years i.e. 30-09-2024 to 30-09-2026",
      "Financial Year": "2024-2025",
      "PO/WO/LOA Date": "2024-09-30",
      "Work Start Date": null,
      "Completion Date as per LOA/PO": "2026-09-30",
      "Latest Work Completion Date (as per Time Extension)": null,
      "Completion Date as per Finla Time Extension / Deviation": null,
      "Client Billing Address": "Station in Charge, Nellore Pooling Station",
      "Name of Authorised Person At Client": "Mr. Anil Kumar Arji \nMr.Dinesh Reddy",
      "Designation of Authorised Person At Client": "JUNIOR ENGINEER (Civil),\nChief Manager",
      "Mobile No. of Authorised Person At Client": "08639940547\n09589251430",
      "Email of Authorised Person At Client": " anilkumararji@powergrid.in\nkethireddy@powergrid.in",
      "Email CC (Client)/C&M": null,
      "Contract Value Version as per LOI/NOA/LOA/DLOA/PO GST Extra": "₹ 43,57,509/-",
      "GST Extra /Including": "18% Gst Extra",
      "Updated Contract Value GST Extra": null,
      "Bank Guarantee Submitted / CPG Not Submitted": null,
      "Bank Guarantee Value": null,
      "Bank Guaratee Expiry Date": null,
      "Bank Guaratee Expiry Date (Claim)": null,
      "Client WO/PO Upload LINK": "https://drive.google.com/file/d/1ThrotMU2mRSgxPo3BYou-7Sed-A9YEAh/view?usp=sharing",
      "Client contract agreement LINK": "https://drive.google.com/file/d/1ErpFESuJh2vWlXUgtYuJyQuD4Tu4_gZF/view?usp=sharing",
      "1st Sub Contractor's Name": "M/S SANVITHA CONSTRUCTIONS",
      "Proprietor / Auth. Signatory of Sub-Cont.": "Ms. Sangana Praveena",
      "Mobile No. of Sub-Cont. Proprietor / Auth. Signatory's": 9494141498,
      "Email of Sub-Cont. Proprietor / Auth. Signatory's": "sanvithareddy2017@gmail.com;",
      "GSTIN of Sub Contractor": "37KRBPS8260L1ZX",
      "WO on % Party": "11%",
      "Work Order No.": "02-10130-12520010",
      "Work Order Date": "2025-07-09",
      "Sub-Contractor Work Order (Upload)": "https://drive.google.com/file/d/1RBCCNTLSLtSy26QatlCa6dQWEqMNIxd6/view?usp=sharing"
    },
    {
      "Current Status": "A5 | Works in Progress Appropriately",
      "Tender Ref. No. / NIT & Date": "Tender Reference Number NTPC/USSC-CPG1/9900288002\nTender ID 2024_NTPC_90365_1",
      "EMD/tender fee Online /Exempted as per MSME bidder": "Exempted ",
      "EMD /online payment received status": null,
      "HR required data for HR clearance RA bill realeased": null,
      "Policy Expired dt./renewal if any": null,
      "Labour License No./date of reg. & expired dt. /BOCW if any": null,
      "Status of PF/ESIC pending amount for HR clearance Running bills": null,
      "Job Allocation No. (JAN)": 10131,
      "EIC at Aakar": "Monika Kochhar",
      "Client Name": "NTPC",
      "State": "Uttarpradesh",
      "Place / City": "Dadri",
      "Name of Work": "BIENNIAL CONTRACT FOR UPKEEPING AND OPERATIONAL SUPPORT FOR CHP STAGE-2 1",
      "PO/WO/LOA Details": "Purchase Order No. : 4000345110-042-1041 Date : 24.10.2024 ( version : 1 Date : 29.10.2024\nRef. No.: LOI - 1041-042-\n24/10/2024",
      "Financial Year": "2024-2025",
      "PO/WO/LOA Date": "2024-10-24",
      "Work Start Date": "01.12.2024   ",
      "Completion Date as per LOA/PO": "30.11.2026",
      "Latest Work Completion Date (as per Time Extension)": null,
      "Completion Date as per Finla Time Extension / Deviation": "NIL",
      "Client Billing Address": "NTPC Limited \n1011 National Capital Power Project\nP.O. VIDYUT NAGAR DADRI GAUTAM BUDH NAGAR(U.P.)\nUttar Pradesh\n201008\nIndia\n0771-2544505\n0771- 2544550\nInvoicing to be done on",
      "Name of Authorised Person At Client": "Mr. Pramod Kumar \nSC Verma \n\nBHARAT VARUN\n\n\nSh Priya Ranjan Kumar, ",
      "Designation of Authorised Person At Client": "DGM \nDGM(FM)\n\nSr. Manager (CHP-OPN)\n\nAGM(FM)",
      "Mobile No. of Authorised Person At Client": "9424141520\n9896406543\n\n9896406543\n\n\n9650966991",
      "Email of Authorised Person At Client": "pramodkumar01@ntpc.co.in \nSCVERMA@NTPC.CO.IN;\n\nBHARATVARUN@NTPC.CO.IN\n\n\nPRKUMAR@NTPC.CO.IN;",
      "Email CC (Client)/C&M": "ANILGUPTA03@NTPC.CO.IN",
      "Contract Value Version as per LOI/NOA/LOA/DLOA/PO GST Extra": 43401900.96,
      "GST Extra /Including": "18% Gst Extra",
      "Updated Contract Value GST Extra": null,
      "Bank Guarantee Submitted / CPG Not Submitted": "SD deuct in RA bill",
      "Bank Guarantee Value": null,
      "Bank Guaratee Expiry Date": null,
      "Bank Guaratee Expiry Date (Claim)": null,
      "Client WO/PO Upload LINK": "https://drive.google.com/file/d/1M7l70RFevk6hwyd09HlGlvGHx_n7uX0U/view?usp=sharing",
      "Client contract agreement LINK": "https://drive.google.com/file/d/1OrdjsuYsw70WWVSVtxdrgKVra3M4qOS-/view?usp=sharing",
      "1st Sub Contractor's Name": "AEC",
      "Proprietor / Auth. Signatory of Sub-Cont.": null,
      "Mobile No. of Sub-Cont. Proprietor / Auth. Signatory's": null,
      "Email of Sub-Cont. Proprietor / Auth. Signatory's": null,
      "GSTIN of Sub Contractor": null,
      "WO on % Party": null,
      "Work Order No.": null,
      "Work Order Date": null,
      "Sub-Contractor Work Order (Upload)": null
    },
    {
      "Current Status": "A5 | Works in Progress Appropriately",
      "Tender Ref. No. / NIT & Date": "24043\nRFX.  5002003506, SPECIFICATION NO: WR2/NT/W-CIVIL/DOM/G01/24/03062\nFile Done By Me\nPrice Opening Date: 07.10.2024 15:30:00",
      "EMD/tender fee Online /Exempted as per MSME bidder": null,
      "EMD /online payment received status": null,
      "HR required data for HR clearance RA bill realeased": null,
      "Policy Expired dt./renewal if any": null,
      "Labour License No./date of reg. & expired dt. /BOCW if any": null,
      "Status of PF/ESIC pending amount for HR clearance Running bills": null,
      "Job Allocation No. (JAN)": 10132,
      "EIC at Aakar": "IRAM",
      "Client Name": "PGCIL",
      "State": null,
      "Place / City": "BHUJ, Gujarat",
      "Name of Work": "Landscaping Work at 765/400/220KV Bhuj Pooling Sub-Station.",
      "PO/WO/LOA Details": "BLOA Ref. No. WR=II/C&M/E-883519/RKS/24-25/BLOA-421 date: 26-10-2024\n05 Months i.e 26-10-2024 to 25-03-2025 ",
      "Financial Year": "2024-2025",
      "PO/WO/LOA Date": "2024-10-26",
      "Work Start Date": "2024-12-15",
      "Completion Date as per LOA/PO": "2025-03-25",
      "Latest Work Completion Date (as per Time Extension)": "2025-12-31",
      "Completion Date as per Finla Time Extension / Deviation": null,
      "Client Billing Address": "DGM, (Bhuj PS) Power Grid Corporation of India Limited Survey No.152/1,Village-Pallanpur (Badi) ,Taluka Nakhatarana, District- Kutch (Gujarat)",
      "Name of Authorised Person At Client": "Bahadur Singh Meena {बहादुर सिंह मीणा} \n\nShri Pushpendra kumar Jaiswal",
      "Designation of Authorised Person At Client": "JE/Bhuj PS\n\nDGM",
      "Mobile No. of Authorised Person At Client": "8432765577\n\n9425409785",
      "Email of Authorised Person At Client": "<bahadurmeena@powergrid.in>\n\npuspendra@powergrid.in",
      "Email CC (Client)/C&M": "rksingh41610@powergrid.in\nRAJESH SINGH\nENGINEER (C&M)\n",
      "Contract Value Version as per LOI/NOA/LOA/DLOA/PO GST Extra": 5555500.37,
      "GST Extra /Including": "18% Gst Extra",
      "Updated Contract Value GST Extra": null,
      "Bank Guarantee Submitted / CPG Not Submitted": "SD shall be deducted from 1st RA Bills as per clause No. 8.3.4 of the LOA",
      "Bank Guarantee Value": 555550,
      "Bank Guaratee Expiry Date": null,
      "Bank Guaratee Expiry Date (Claim)": null,
      "Client WO/PO Upload LINK": "https://drive.google.com/file/d/1DaAYkNezqu2sLluAF-QitUS8PW2bLhFL/view?usp=sharing",
      "Client contract agreement LINK": "https://drive.google.com/file/d/1l-I291tjhimPFZsJzjEId2kCKwJ6shcw/view?usp=sharing",
      "1st Sub Contractor's Name": "M/s DEVSHRDDHA CONSTRUCTION",
      "Proprietor / Auth. Signatory of Sub-Cont.": "91+ 9099801000",
      "Mobile No. of Sub-Cont. Proprietor / Auth. Signatory's": "jugalrajgor@gmail.com",
      "Email of Sub-Cont. Proprietor / Auth. Signatory's": null,
      "GSTIN of Sub Contractor": "24ALQPG5095G1ZV",
      "WO on % Party": 0.02,
      "Work Order No.": "10132-12420146",
      "Work Order Date": "2025-01-28",
      "Sub-Contractor Work Order (Upload)": "https://drive.google.com/file/d/1qWoe5xhtc9V9BcVdHmWaLZeYwEBzJqVQ/view?usp=sharing"
    },
    {
      "Current Status": "A5 | Works in Progress Appropriately",
      "Tender Ref. No. / NIT & Date": "24603 \nSpecification No(s): NIT Ref.: WR-I/C&M/VRL/NIT-195/I-3567-2024/RFX-5002003847\nLink Mail Done on dt 04-10-2024\nIntegrity Pact Required: - No\nPrice Opening Date: 19.11.2024 15:00:00",
      "EMD/tender fee Online /Exempted as per MSME bidder": null,
      "EMD /online payment received status": null,
      "HR required data for HR clearance RA bill realeased": null,
      "Policy Expired dt./renewal if any": null,
      "Labour License No./date of reg. & expired dt. /BOCW if any": null,
      "Status of PF/ESIC pending amount for HR clearance Running bills": null,
      "Job Allocation No. (JAN)": 10135,
      "EIC at Aakar": "IRAM  ",
      "Client Name": "PGCIL",
      "State": null,
      "Place / City": "Wardha, Maharashtra",
      "Name of Work": "Painting of Office Buildings and Boundary Wall of Ss & Ts at 765/400/220 KV Wardha Substation.",
      "PO/WO/LOA Details": "Ref No.: WR-I/C&M/VRL/NIT-195/I-3567-2024/NOA-1579/1389 दिनाक: 13.12.2024, SAP PO NO. 5100054698\n08 months 13-12-2024 to 12-08-2025",
      "Financial Year": "2024-2025",
      "PO/WO/LOA Date": "2024-12-13",
      "Work Start Date": null,
      "Completion Date as per LOA/PO": "2025-08-12",
      "Latest Work Completion Date (as per Time Extension)": "2026-02-28",
      "Completion Date as per Finla Time Extension / Deviation": null,
      "Client Billing Address": "Sr DGM, Wardha\nPowerGrid Corporation of India Ltd. ,\nPlot No. D-1 , MIDC Area , Deoli ,\nDistt-Wardha-442 101 – Maharastra\nSh. Shripad Waman Kolte, Sr. DGM\nMob. No. 9423072643",
      "Name of Authorised Person At Client": "Mr.Kaushal Kumar\nShripad Waman Kolte {श्रीपद वामन कोल्‍टे}",
      "Designation of Authorised Person At Client": "J.E \nSr. DGM",
      "Mobile No. of Authorised Person At Client": "7352969020\n9423072643",
      "Email of Authorised Person At Client": "swkolte@powergrid.in",
      "Email CC (Client)/C&M": "Vijay Rambhau Likhar {विजय आर. लिखार} <vijayrlikhar@powergrid.in>\nमहाराष्ट्र, मोबाइल- +  9423762540\n",
      "Contract Value Version as per LOI/NOA/LOA/DLOA/PO GST Extra": "2888691.92\n\n2448044.00",
      "GST Extra /Including": "GST 18% Including\n\nGST 18% Extra",
      "Updated Contract Value GST Extra": null,
      "Bank Guarantee Submitted / CPG Not Submitted": "Not Mention in NOA & SCC of tender Documnets\n\nBG WILL HAVE TO SUBMIT",
      "Bank Guarantee Value": 244804.4,
      "Bank Guaratee Expiry Date": null,
      "Bank Guaratee Expiry Date (Claim)": null,
      "Client WO/PO Upload LINK": "https://drive.google.com/file/d/1UIrlwwXhU4AMmdgtyJhbXzsylyvsJeRH/view?usp=sharing",
      "Client contract agreement LINK": null,
      "1st Sub Contractor's Name": "M/s Rajavat Interiors Construction & Traders ",
      "Proprietor / Auth. Signatory of Sub-Cont.": "Mr. Dev Singh ",
      "Mobile No. of Sub-Cont. Proprietor / Auth. Signatory's": "09826339996 | 09424847494",
      "Email of Sub-Cont. Proprietor / Auth. Signatory's": "rajavatinteriors@gmail.com",
      "GSTIN of Sub Contractor": "23AIVPD0911G1ZM",
      "WO on % Party": 0.12,
      "Work Order No.": " 03-10135-12420149",
      "Work Order Date": "2025-02-12",
      "Sub-Contractor Work Order (Upload)": "https://drive.google.com/file/d/1VKqGOzgE_bpJV7X_-yTunfT84TUdnIF-/view?usp=sharing"
    },
    {
      "Current Status": "A5 | Works in Progress Appropriately",
      "Tender Ref. No. / NIT & Date": "24730\nSPECIFICATION NO: WR2/NT/W-CIVIL/DOM/G01/24/13864, RFx Number 5006005726 in NIT But RFX. On PRAINT PORTAL 5002003950\nLink Already Enabled\nIntegrity Pact Required: - Yes\nQuery dt 03-12-2024, which is to be submitted upto 09-12-2024",
      "EMD/tender fee Online /Exempted as per MSME bidder": null,
      "EMD /online payment received status": null,
      "HR required data for HR clearance RA bill realeased": null,
      "Policy Expired dt./renewal if any": null,
      "Labour License No./date of reg. & expired dt. /BOCW if any": null,
      "Status of PF/ESIC pending amount for HR clearance Running bills": null,
      "Job Allocation No. (JAN)": 10136,
      "EIC at Aakar": "IRAM",
      "Client Name": "PGCIL",
      "State": null,
      "Place / City": "Boisar Sub-Station, Maharashtra",
      "Name of Work": "Civil Works Pertaining Augmentation of Transformation Capacity at 400/220 kV Boisar Sub-Station in Maharashtra by 400/220 kV, 1x500 MVA (5th) ICT.",
      "PO/WO/LOA Details": "NOA REF. No.:  WR-II/C&M/E 865224/NV/24-25/LOA-601 Date 22-01-2025 \n& LOA Ref. No.: WR-II/C&M/E 865224/NV/24-25/LOA-601 Date 29-01-2025.\n05 Months i.e. 22-01-2025 to 22-06-2025",
      "Financial Year": "2024-2025",
      "PO/WO/LOA Date": "2025-01-22",
      "Work Start Date": null,
      "Completion Date as per LOA/PO": "2025-06-22",
      "Latest Work Completion Date (as per Time Extension)": "2025-12-31",
      "Completion Date as per Finla Time Extension / Deviation": null,
      "Client Billing Address": "The Sr DGM\nPower Grid Corporation of India Limited \n400/220 kv Boisar Substation,",
      "Name of Authorised Person At Client": "Shrirang Moreshwar Vartak {श्रीरंग वर्तक}",
      "Designation of Authorised Person At Client": "Sr. Deputy General Manager  ",
      "Mobile No. of Authorised Person At Client": 9429893652,
      "Email of Authorised Person At Client": "shrirang@powergrid.in",
      "Email CC (Client)/C&M": "cnmwr2@powergrid.in",
      "Contract Value Version as per LOI/NOA/LOA/DLOA/PO GST Extra": 25895391,
      "GST Extra /Including": "18% Gst Extra",
      "Updated Contract Value GST Extra": null,
      "Bank Guarantee Submitted / CPG Not Submitted": "SD shall be deducted from first Running RA Bills as per clause no. 8.3.4 of the of GCC of the bid documents.",
      "Bank Guarantee Value": 2589539.1,
      "Bank Guaratee Expiry Date": null,
      "Bank Guaratee Expiry Date (Claim)": null,
      "Client WO/PO Upload LINK": "https://drive.google.com/file/d/15clFOzr0X-49oux8fBQZSKlq5IRCRhI4/view?usp=sharing\nhttps://drive.google.com/file/d/13u29QSOtwPuHT3JA7-fiaWeVsTvTMGOU/view?usp=sharing",
      "Client contract agreement LINK": "https://drive.google.com/file/d/1diFjjQSUaEAGN93lg6Sw5g-Vj8Ikbf0d/view?usp=sharing",
      "1st Sub Contractor's Name": "M/s COCHIN ENGINEERING PROJECTS INDIA PRIVATE LIMTED",
      "Proprietor / Auth. Signatory of Sub-Cont.": "Mr. UmeshM Manickan ",
      "Mobile No. of Sub-Cont. Proprietor / Auth. Signatory's": "89430 31000",
      "Email of Sub-Cont. Proprietor / Auth. Signatory's": "info.cepipl@gmail.com, director.cepipl@gmail.com",
      "GSTIN of Sub Contractor": "32AALCC7219F1ZT",
      "WO on % Party": 0.05,
      "Work Order No.": "01-10136-12420148\t",
      "Work Order Date": "14-08-2025\n\n07/02/2025\n",
      "Sub-Contractor Work Order (Upload)": "https://drive.google.com/file/d/1ffN6JGqoJCIRF-LiA6IZv0ClrFTG6PVQ/view?usp=sharing"
    },
    {
      "Current Status": "A5 | Works in Progress Appropriately",
      "Tender Ref. No. / NIT & Date": "24796\nSPECIFICATION NO.: NR3/NT/W-CIVIL/DOM/K00/24/14070 (RFx 5002003962)\nLink Mail Done | Link Has been Enable\nIntegrity Pact Required - No\nBid Opening Statement\nPrice Opening has been scheduled on 21.01.2025 / 10:00:00",
      "EMD/tender fee Online /Exempted as per MSME bidder": null,
      "EMD /online payment received status": null,
      "HR required data for HR clearance RA bill realeased": null,
      "Policy Expired dt./renewal if any": null,
      "Labour License No./date of reg. & expired dt. /BOCW if any": null,
      "Status of PF/ESIC pending amount for HR clearance Running bills": null,
      "Job Allocation No. (JAN)": 10137,
      "EIC at Aakar": "IRAM",
      "Client Name": "PGCIL",
      "State": null,
      "Place / City": "Orai substation, Distt- Jalaun, U.P",
      "Name of Work": "Site Package A2 (Civil Works) for Extension of 765 kV Orai substation (Shifting & conversion of 765kV fixed line reactor to bus reactor) under Western Region Expansion Scheme XXXIII (WRES-XXXIII): Part C1.",
      "PO/WO/LOA Details": "DLOA Ref No: NR-III/C&M/2025/5002003962/LOA/25-101188/01, date:29-01-2025\n9  Months i.e 29-01-2025 to 29-10-2025",
      "Financial Year": "2024-2025",
      "PO/WO/LOA Date": "2025-01-29",
      "Work Start Date": "2025-04-14",
      "Completion Date as per LOA/PO": "2025-10-29",
      "Latest Work Completion Date (as per Time Extension)": "2026-01-31",
      "Completion Date as per Finla Time Extension / Deviation": null,
      "Client Billing Address": "The DGM, \nPower Grid Corporation of India Limited \n765/400 kv Orai Substation \nDistt. Jalaun",
      "Name of Authorised Person At Client": "Rajnikant Agrawal {रजनीकांत अग्रवाल}",
      "Designation of Authorised Person At Client": "Sr. DGM ",
      "Mobile No. of Authorised Person At Client": 7895000703,
      "Email of Authorised Person At Client": "rkagarwal@powergrid.in",
      "Email CC (Client)/C&M": "Pallavi Mishra | Chief Mgr(C&M)\nNR-III RHQ, Lucknow | pallavi.mishra@powergrid.in",
      "Contract Value Version as per LOI/NOA/LOA/DLOA/PO GST Extra": "1,30,53,089/- \n\n15402645.16",
      "GST Extra /Including": "GST 18% Extra\n\nGST 18% Incl.",
      "Updated Contract Value GST Extra": null,
      "Bank Guarantee Submitted / CPG Not Submitted": "The value of CPG/SD shall be as per clause 18.0 of SCC Volume IB INR 13,05,309/-",
      "Bank Guarantee Value": 1305309,
      "Bank Guaratee Expiry Date": null,
      "Bank Guaratee Expiry Date (Claim)": null,
      "Client WO/PO Upload LINK": "https://drive.google.com/file/d/1lXcuU3WVhryL_TH10GfdWx4I1KRW6Aun/view?usp=sharing",
      "Client contract agreement LINK": null,
      "1st Sub Contractor's Name": "M/s HARI SHIV SHAKTI STONE CRUSHING COMPANY",
      "Proprietor / Auth. Signatory of Sub-Cont.": "Mr. Vinay Sirohi",
      "Mobile No. of Sub-Cont. Proprietor / Auth. Signatory's": 7055225111,
      "Email of Sub-Cont. Proprietor / Auth. Signatory's": "vinaysirohi05@gmail.com",
      "GSTIN of Sub Contractor": "23AAKFH0514N1ZH",
      "WO on % Party": "5%",
      "Work Order No.": "03-10137-12520012",
      "Work Order Date": "2025-07-25",
      "Sub-Contractor Work Order (Upload)": "https://drive.google.com/file/d/19-W98CIZUuQr-W3sogdOoghF2uWRP3oU/view?usp=sharing"
    },
    {
      "Current Status": "A6 | Work Awarded but to be started",
      "Tender Ref. No. / NIT & Date": "Limited Tender \n Package No.: N2JM/C&M/CS/57(24), RFX. 5006005505 \n No need to change the rates as per telephonic discussion with Mr Khalid\n 2024 09 10 Query Telephonic, Submitted\n Bid Opening Statement",
      "EMD/tender fee Online /Exempted as per MSME bidder": null,
      "EMD /online payment received status": null,
      "HR required data for HR clearance RA bill realeased": null,
      "Policy Expired dt./renewal if any": null,
      "Labour License No./date of reg. & expired dt. /BOCW if any": null,
      "Status of PF/ESIC pending amount for HR clearance Running bills": null,
      "Job Allocation No. (JAN)": 10138,
      "EIC at Aakar": "IRAM",
      "Client Name": "PGCIL",
      "State": null,
      "Place / City": "Drass, Kargil & Khalsti Substations",
      "Name of Work": "Construction of approach road for closed store buildings at Drass, Kargil & Khalsti Substations and Patrolling Path at Drass & Kargil Substations.",
      "PO/WO/LOA Details": "SAP PO Ref. No. 4100006691 dt:28-02-2025, NOA : 4000005936\n 3 MONTHS i.e. 28/02/2025 to 27-05-2025",
      "Financial Year": "2024-2025",
      "PO/WO/LOA Date": "2025-02-28",
      "Work Start Date": null,
      "Completion Date as per LOA/PO": "2025-05-27",
      "Latest Work Completion Date (as per Time Extension)": "2026-07-31",
      "Completion Date as per Finla Time Extension / Deviation": null,
      "Client Billing Address": "To Sr. GM, Ladakh\n Power Grid Corporation of India Limited, Drass Sub Station 194102, Rampur.",
      "Name of Authorised Person At Client": "Sh Arshad Iqbal Shah",
      "Designation of Authorised Person At Client": "Sr. GM, Ladakh",
      "Mobile No. of Authorised Person At Client": 9797860055,
      "Email of Authorised Person At Client": "arshadiqbal@powergrid.in",
      "Email CC (Client)/C&M": "Azeem Akbar Drabu | azeemdrabu@powergrid.in\n (Asst Manager C&M)\n Amit Kumar Patel |amitpatel@powergrid.in\n Bikram Singh Kalsi | bikramsinghkalsi@powergrid.in\n Bhupendra Pal Singh | bhupendra@powergrid.in\n Gurdeep Singh | gurdeep.singh@powergrid.in",
      "Contract Value Version as per LOI/NOA/LOA/DLOA/PO GST Extra": "2922770.75\n \n 3448869.51",
      "GST Extra /Including": "GST 18% Extra\n \n GST 18% Incl.",
      "Updated Contract Value GST Extra": null,
      "Bank Guarantee Submitted / CPG Not Submitted": "SD shall be deducted from RA Bills\n as per LOA clause 4.3 (alternatively)",
      "Bank Guarantee Value": "2,92,277/-",
      "Bank Guaratee Expiry Date": null,
      "Bank Guaratee Expiry Date (Claim)": null,
      "Client WO/PO Upload LINK": "https://drive.google.com/file/d/11T7C593CgbW2qWgHhgwnAppAjfbAqgQr/view?usp=sharing",
      "Client contract agreement LINK": "NA As In vol - I (03 Section-III BDS Volume-I CS-57(24)) Clause No. ITB 34 , point 65 (page No. 22 & 23)",
      "1st Sub Contractor's Name": "WO Pending \n\nKing Construction & Builders",
      "Proprietor / Auth. Signatory of Sub-Cont.": "Md. Khalid / Md. Gani",
      "Mobile No. of Sub-Cont. Proprietor / Auth. Signatory's": 1835425649136,
      "Email of Sub-Cont. Proprietor / Auth. Signatory's": "kingconstructions1@gmail.com\n khalid_sgr@rediffmail.com",
      "GSTIN of Sub Contractor": "01AAVPW5940N1ZW",
      "WO on % Party": "To be Discussed",
      "Work Order No.": null,
      "Work Order Date": null,
      "Sub-Contractor Work Order (Upload)": null
    },
    {
      "Current Status": "A6 | Work Awarded but to be started",
      "Tender Ref. No. / NIT & Date": "Closed Limited\nTender Reference Number: 03/000011/2025\nTender ID: 2025_BEL_96893_1",
      "EMD/tender fee Online /Exempted as per MSME bidder": null,
      "EMD /online payment received status": null,
      "HR required data for HR clearance RA bill realeased": null,
      "Policy Expired dt./renewal if any": null,
      "Labour License No./date of reg. & expired dt. /BOCW if any": null,
      "Status of PF/ESIC pending amount for HR clearance Running bills": null,
      "Job Allocation No. (JAN)": 10139,
      "EIC at Aakar": "IRAM",
      "Client Name": "BEL",
      "State": null,
      "Place / City": "(Chennai) Tamil Nadu",
      "Name of Work": "Infrastructure Facilities for Aero Hub at Sriperumbudur (Chennai) Tamil Nadu.",
      "PO/WO/LOA Details": "LOI Ref No: 03/000011/2025 dt: 26-04-2025\n4 Months after 14 days of issuance of LOI i.e. 10-05-2025 to 09-09-2025\nSite Clearence Mail Received on dt 04-06-2025 So time duration shall be 04-06-2025 to 04-10-2025",
      "Financial Year": "2024-2025",
      "PO/WO/LOA Date": "2025-04-26",
      "Work Start Date": "10/05/2025\nClearence - 04-06-2025",
      "Completion Date as per LOA/PO": "09/09/2025\n\n04-10-2025",
      "Latest Work Completion Date (as per Time Extension)": "2026-02-04",
      "Completion Date as per Finla Time Extension / Deviation": null,
      "Client Billing Address": "The DY Manager\n(Engineering Ser / BG CX ) \nVWQC+JMG Sirukalathur, Tamil Nadu.\nPh No. : 080-22195115\n\nBangalore :\nBharat Electronics Limited\nJalahalli Post\nBangalore - 560013\n",
      "Name of Authorised Person At Client": "Arvind Singh",
      "Designation of Authorised Person At Client": "DY.MANAGER(PMG-1/ES)",
      "Mobile No. of Authorised Person At Client": "MOB.No: +919986050347\n\n080-22195115",
      "Email of Authorised Person At Client": "arvindsinghs@bel.co.in",
      "Email CC (Client)/C&M": "pc.ewdtf@bel.co.in\n\ninfo.ewdtf@bel.co.in\n\nsukhdev@bel.co.in (F&A)",
      "Contract Value Version as per LOI/NOA/LOA/DLOA/PO GST Extra": 22670468.26,
      "GST Extra /Including": "Exclusive of GST",
      "Updated Contract Value GST Extra": null,
      "Bank Guarantee Submitted / CPG Not Submitted": "As per clause 4.0 of LOI 1% DD i.e. Rs. 2,26,800/- shall be deposited in bank \n& Rs. 22,67,100.00 may be deducted from RA Bills OR we may submit BG for the same if possible",
      "Bank Guarantee Value": "Rs. 2,26,800/- (DD)\n\nRs. 22,67,100.00 (RA BILL OR BG",
      "Bank Guaratee Expiry Date": null,
      "Bank Guaratee Expiry Date (Claim)": null,
      "Client WO/PO Upload LINK": "https://drive.google.com/file/d/16lhKuQuffJ_LK2zMOJyyQiVpLCuBh_B6/view?usp=sharing",
      "Client contract agreement LINK": "https://drive.google.com/file/d/15_7IvfEKA0rwHIXARa6YxZYWcnwNqBo_/view?usp=sharing",
      "1st Sub Contractor's Name": "M/s SASMI INFRA & CO",
      "Proprietor / Auth. Signatory of Sub-Cont.": "Mr. VEERARAGAVAN SURYA ",
      "Mobile No. of Sub-Cont. Proprietor / Auth. Signatory's": "9626917866, 9042696435",
      "Email of Sub-Cont. Proprietor / Auth. Signatory's": "sasmi.infra18@gmail.com ",
      "GSTIN of Sub Contractor": "33IKKPS7376R2ZS",
      "WO on % Party": 0.1,
      "Work Order No.": "02-10139-12520016",
      "Work Order Date": "2025-08-20",
      "Sub-Contractor Work Order (Upload)": "WO Cancelled"
    },
    {
      "Current Status": "A5 | Works in Progress Appropriately",
      "Tender Ref. No. / NIT & Date": "GEM/2025/B/5972293\nNTPC/USSC–CPG1/9900297556",
      "EMD/tender fee Online /Exempted as per MSME bidder": "Exempted ",
      "EMD /online payment received status": null,
      "HR required data for HR clearance RA bill realeased": null,
      "Policy Expired dt./renewal if any": null,
      "Labour License No./date of reg. & expired dt. /BOCW if any": null,
      "Status of PF/ESIC pending amount for HR clearance Running bills": null,
      "Job Allocation No. (JAN)": 10140,
      "EIC at Aakar": "Monika Kochhar",
      "Client Name": "NTPC",
      "State": "Bihar",
      "Place / City": "Barh",
      "Name of Work": "Manual Unloading of Coal from BOXN/ BOXNHL and\nBOBR/ BOBRN Rakes at Track Hopper, NTPC Barh.",
      "PO/WO/LOA Details": "Purchase Order No. : 4000359253-064-1041 Date : 29.04.2025\nContract No: GEMC-511687743490213",
      "Financial Year": "2025-2027",
      "PO/WO/LOA Date": "29.04.2025",
      "Work Start Date": "2025-05-12",
      "Completion Date as per LOA/PO": "2027-05-11",
      "Latest Work Completion Date (as per Time Extension)": null,
      "Completion Date as per Finla Time Extension / Deviation": "NIL",
      "Client Billing Address": "NTPC Limited \n1028 Barh Super Thermal Power Project\nP.O. BARH BARH PATNA\nBihar\n803213\nIndia\n0771-2544505\n0771- 2544550\nInvoicing to be done on\nGST No. : 10AAACN0255D2ZC",
      "Name of Authorised Person At Client": " MR. Vemula Hari Hara Rayalu\nTransfer  ( NTPC Karnataka )\n\nSalil Kr. Pandey\n\nMr. Pushkar",
      "Designation of Authorised Person At Client": "( AGM FM)\n\n\n\nAGM \n\nengineer",
      "Mobile No. of Authorised Person At Client": "9445869081\n\n\n\n 8004942641\n\n7368807203",
      "Email of Authorised Person At Client": "VHHRAYALU@NTPC.CO.IN\n\n\n\nSALILKUMARPANDEY@NTPC.CO.IN\npushkar@ntpc.co.in\n\n\n\nHRMALLICK@NTPC.CO.IN",
      "Email CC (Client)/C&M": "\n\nC&M Raipur  PO issued\nBHUPESHGUPTA@NTPC.CO.IN;MONIKASAGAR@NTPC.CO.IN",
      "Contract Value Version as per LOI/NOA/LOA/DLOA/PO GST Extra": 31159506.78,
      "GST Extra /Including": "GST 18% Extra\n ",
      "Updated Contract Value GST Extra": null,
      "Bank Guarantee Submitted / CPG Not Submitted": "SD deuct in RA bill",
      "Bank Guarantee Value": null,
      "Bank Guaratee Expiry Date": null,
      "Bank Guaratee Expiry Date (Claim)": null,
      "Client WO/PO Upload LINK": "https://drive.google.com/file/d/13TU3UF8bPzTn8xKL2KaSJNqXpQ_u8zBl/view?usp=sharing",
      "Client contract agreement LINK": "https://drive.google.com/file/d/15mbOgZjvfo3rn78GnfVPbXChwg6LeFGA/view?usp=sharing",
      "1st Sub Contractor's Name": "M/s MAGADHEERA CONSTRUCTION",
      "Proprietor / Auth. Signatory of Sub-Cont.": "Mr. Ravi Shankar Vidyarthi ",
      "Mobile No. of Sub-Cont. Proprietor / Auth. Signatory's": "91 9153217419",
      "Email of Sub-Cont. Proprietor / Auth. Signatory's": "vidyarthi1991@gmail.com;",
      "GSTIN of Sub Contractor": "10BOGPD7641D1ZK",
      "WO on % Party": "6%",
      "Work Order No.": "                                                                                                                                                                                                                                                                                                                                                                                                ",
      "Work Order Date": "2025-05-10",
      "Sub-Contractor Work Order (Upload)": "https://drive.google.com/file/d/1wRkXbEyOqv6aAauaE1wtOy0oZjm46_48/view?usp=sharing\n\nhttps://drive.google.com/file/d/1jtZeDydt0FKQApmUZaotyTqahJ8wakeN/view?usp=sharing"
    },
    {
      "Current Status": "A5 | Works in Progress Appropriately",
      "Tender Ref. No. / NIT & Date": "SPECIFICATION NO.: NR2/NT/W-CIVIL/DOM/J01/25/12796\nRFX: 5002004786\nPACKAGE NUMBER:            N2JM/C&M/CS/251(25)\n\nLINK ALREADY ENABLE\nIP REQUIRED",
      "EMD/tender fee Online /Exempted as per MSME bidder": null,
      "EMD /online payment received status": null,
      "HR required data for HR clearance RA bill realeased": null,
      "Policy Expired dt./renewal if any": null,
      "Labour License No./date of reg. & expired dt. /BOCW if any": null,
      "Status of PF/ESIC pending amount for HR clearance Running bills": null,
      "Job Allocation No. (JAN)": 10141,
      "EIC at Aakar": "IRAM",
      "Client Name": "PGCIL",
      "State": null,
      "Place / City": "Jammu (J&K)",
      "Name of Work": "Facelifting/Civil Renovation of IDBI vacated Ground floor portion of RHQ Building for RTAMC Upgradation project. (Package-1).",
      "PO/WO/LOA Details": "BLOA No.: N2JM/C&M/CS/251(25)/BLOA/25-112339 Date: 13-10-2025\n3 Months i.e. 13-10-2025 to 12-01-2026",
      "Financial Year": "2025-2026",
      "PO/WO/LOA Date": "2025-10-13",
      "Work Start Date": "2025-11-10",
      "Completion Date as per LOA/PO": "2026-01-12",
      "Latest Work Completion Date (as per Time Extension)": null,
      "Completion Date as per Finla Time Extension / Deviation": null,
      "Client Billing Address": "M/s Power Grid Corporation of India Limited\nESG Department.\nOffice Block no. 26, Rail Head Complex Jammu-180012.",
      "Name of Authorised Person At Client": "Ms. Sudharma ",
      "Designation of Authorised Person At Client": "[DGM(C&M)]",
      "Mobile No. of Authorised Person At Client": null,
      "Email of Authorised Person At Client": null,
      "Email CC (Client)/C&M": null,
      "Contract Value Version as per LOI/NOA/LOA/DLOA/PO GST Extra": "91,65,954\n\n\n1,12,66,485.29",
      "GST Extra /Including": "GST 18% Extra\n\n GST including",
      "Updated Contract Value GST Extra": null,
      "Bank Guarantee Submitted / CPG Not Submitted": "CPG 10% (9,16,595/-)",
      "Bank Guarantee Value": null,
      "Bank Guaratee Expiry Date": null,
      "Bank Guaratee Expiry Date (Claim)": null,
      "Client WO/PO Upload LINK": "https://drive.google.com/file/d/1GmD_ry5EBAQN_STGiqRffwiwf0kJ-8Ty/view?usp=sharing",
      "Client contract agreement LINK": null,
      "1st Sub Contractor's Name": null,
      "Proprietor / Auth. Signatory of Sub-Cont.": null,
      "Mobile No. of Sub-Cont. Proprietor / Auth. Signatory's": null,
      "Email of Sub-Cont. Proprietor / Auth. Signatory's": null,
      "GSTIN of Sub Contractor": null,
      "WO on % Party": null,
      "Work Order No.": null,
      "Work Order Date": null,
      "Sub-Contractor Work Order (Upload)": null
    },
    {
      "Current Status": "A6 | Work Awarded but to be started",
      "Tender Ref. No. / NIT & Date": "25685\nSpecification No.: NR1/T/W-CIVIL/DOM/I00/25/05458 – \nRFx Number 5002004419 ",
      "EMD/tender fee Online /Exempted as per MSME bidder": null,
      "EMD /online payment received status": null,
      "HR required data for HR clearance RA bill realeased": null,
      "Policy Expired dt./renewal if any": null,
      "Labour License No./date of reg. & expired dt. /BOCW if any": null,
      "Status of PF/ESIC pending amount for HR clearance Running bills": null,
      "Job Allocation No. (JAN)": 10142,
      "EIC at Aakar": "IRAM",
      "Client Name": "PGCIL",
      "State": null,
      "Place / City": "Jaipur, Rajasthan",
      "Name of Work": "Construction of Closed Store, Open Store, Oil Shed & Watchtowers at 765/400 kV Dausa Substation",
      "PO/WO/LOA Details": "NOA Ref. No.: RP/JP/C&M/25-26/OT/SRM/NOA/25-112530     Date: 03.11.2025\nFour (04) Months i.e. 03-11-2025 to 02-03-2026",
      "Financial Year": "2025-2026",
      "PO/WO/LOA Date": "2025-11-03",
      "Work Start Date": null,
      "Completion Date as per LOA/PO": "2026-03-02",
      "Latest Work Completion Date (as per Time Extension)": null,
      "Completion Date as per Finla Time Extension / Deviation": null,
      "Client Billing Address": "M/s Power Grid Beawar Dausa Transmission Limited \n\nPower Grid Corporation of India Limited\nRajasthan Project Office, Jaipur (Rajasthan)",
      "Name of Authorised Person At Client": "Vijay Prakash Jarwal",
      "Designation of Authorised Person At Client": "[DGM(C&M)]",
      "Mobile No. of Authorised Person At Client": 9149469200,
      "Email of Authorised Person At Client": "vijayprakashjarwal@powergrid.in",
      "Email CC (Client)/C&M": null,
      "Contract Value Version as per LOI/NOA/LOA/DLOA/PO GST Extra": 20864320.69,
      "GST Extra /Including": "GST 18% Extra",
      "Updated Contract Value GST Extra": null,
      "Bank Guarantee Submitted / CPG Not Submitted": "CPG 10% (20,86,432)",
      "Bank Guarantee Value": null,
      "Bank Guaratee Expiry Date": null,
      "Bank Guaratee Expiry Date (Claim)": null,
      "Client WO/PO Upload LINK": "https://drive.google.com/file/d/1Ryz__nT99fzF9nPGUCIXYkstD4abWI94/view?usp=sharing",
      "Client contract agreement LINK": null,
      "1st Sub Contractor's Name": "M/s VS Aditya Buildcon",
      "Proprietor / Auth. Signatory of Sub-Cont.": "Mr. Vinay Sirohi",
      "Mobile No. of Sub-Cont. Proprietor / Auth. Signatory's": 7055225111,
      "Email of Sub-Cont. Proprietor / Auth. Signatory's": "vinaysirohi05@gmail.com",
      "GSTIN of Sub Contractor": " 09CKZPS7305F2ZE",
      "WO on % Party": "5%",
      "Work Order No.": "01-10142-12520019\t",
      "Work Order Date": "2025-11-18",
      "Sub-Contractor Work Order (Upload)": "mail on 24-11-2025"
    },
    {
      "Current Status": "A3 | Running Works in Progress but delayed for Last 12 Months",
      "Tender Ref. No. / NIT & Date": "SPECIFICATION NO: NESH/CSM/SRM/OT/5000-03, Rfx. 5002001796\nIntegrity Pact Required Yes\nINR 1,08,88,963.45 /-(exclusive of GST)\n06(Six) months from the date of NOA/LOA.\nBid Opening Statement \nQuery 27-09-2021 UDIN , Submitted on 27-09-2021 & again 09-10-2021\nPrice open Single Bidder",
      "EMD/tender fee Online /Exempted as per MSME bidder": "From RA Bill",
      "EMD /online payment received status": null,
      "HR required data for HR clearance RA bill realeased": null,
      "Policy Expired dt./renewal if any": null,
      "Labour License No./date of reg. & expired dt. /BOCW if any": null,
      "Status of PF/ESIC pending amount for HR clearance Running bills": null,
      "Job Allocation No. (JAN)": 20022,
      "EIC at Aakar": "IRAM ",
      "Client Name": "PGCIL",
      "State": null,
      "Place / City": "Misa Sub -Station",
      "Name of Work": "Construction of Hi-tech Class-Cum Conference Room at Misa EDC at Misa Sub -Station.",
      "PO/WO/LOA Details": "vide NOA Ref. No. NESH/CSM/FY:2021-22/5000-23/NOA/149 dt 23-12-2021.” SAP  P.O. Number : 6800009930\nversion : 1 Date : 19.09.2022\n",
      "Financial Year": "2021-22",
      "PO/WO/LOA Date": "2021-12-23",
      "Work Start Date": null,
      "Completion Date as per LOA/PO": "2022-06-23",
      "Latest Work Completion Date (as per Time Extension)": "2026-01-31",
      "Completion Date as per Finla Time Extension / Deviation": null,
      "Client Billing Address": "The DGM (I/E),\nPh no: 9436302823\n400/220 kV Misa Sub-station,\nPOWERGRID,\nVillage: Veluguri, Pin-782427\nDist: Hojai, Assam.",
      "Name of Authorised Person At Client": "Navin Kumar Mahato {नवीन कुमार महतो} \n\nShri Rumi Chakraborty\n\nMADHURJYA KAKATI ",
      "Designation of Authorised Person At Client": "Ch. Manager (I/C)\n\nChief Manager",
      "Mobile No. of Authorised Person At Client": "Ph- 9099995703/9436175830 \n\nPh no: 9436302823\n8473056231 / 9435555368",
      "Email of Authorised Person At Client": "To,\nmrinmoymajumder97@powergrid.in\n\nCC,\nnmahato@powergrid.in\ndebashisdas@powergrid.in\n\nr.chakraborty@powergrid.in\nmadhurjyakakati@powergrid.in\n\nj.n.khataniar@gmail.com\nnmborah@powergrid.in",
      "Email CC (Client)/C&M": null,
      "Contract Value Version as per LOI/NOA/LOA/DLOA/PO GST Extra": 11704211,
      "GST Extra /Including": null,
      "Updated Contract Value GST Extra": 12795811,
      "Bank Guarantee Submitted / CPG Not Submitted": "Deduction Form 1st RA Bill",
      "Bank Guarantee Value": null,
      "Bank Guaratee Expiry Date": null,
      "Bank Guaratee Expiry Date (Claim)": null,
      "Client WO/PO Upload LINK": "https://drive.google.com/drive/folders/1yEmUdKIvJBzoASMapkD1sS3NkVKr4Adr?usp=sharing",
      "Client contract agreement LINK": "https://drive.google.com/file/d/1f0_0rCLnm4Xig2mOzMpgmTuARBOyBm08/view?usp=sharing",
      "1st Sub Contractor's Name": "M/S AR INFRATECH",
      "Proprietor / Auth. Signatory of Sub-Cont.": "ANJU SINGH",
      "Mobile No. of Sub-Cont. Proprietor / Auth. Signatory's": "8130529991 | 8076325375",
      "Email of Sub-Cont. Proprietor / Auth. Signatory's": "raj1977.singh@gmail.com",
      "GSTIN of Sub Contractor": "09OBZPS8680E1Z8",
      "WO on % Party": 0.1,
      "Work Order No.": "02-20022-224240",
      "Work Order Date": "2024-11-15",
      "Sub-Contractor Work Order (Upload)": "https://drive.google.com/file/d/1tFl-Pu37A3BNNobG7MDaHjP0KFJhxvL_/view?usp=sharing"
    },
    {
      "Current Status": "A5 | Works in Progress Appropriately",
      "Tender Ref. No. / NIT & Date": "Specification No(s): WR-I/C&M/SYE/I-2022/NIT-82/2023/Rfx- 5002002731 \nIntegrity Pact Required -YES\nPrice Opening Date: 24.07.2023 15:30:00\nPrice Opening Date: 13.09.2023 11:00:00\nL2 \nWe are L1 After due to non fill GST by L1 Party",
      "EMD/tender fee Online /Exempted as per MSME bidder": null,
      "EMD /online payment received status": null,
      "HR required data for HR clearance RA bill realeased": null,
      "Policy Expired dt./renewal if any": null,
      "Labour License No./date of reg. & expired dt. /BOCW if any": null,
      "Status of PF/ESIC pending amount for HR clearance Running bills": null,
      "Job Allocation No. (JAN)": 20036,
      "EIC at Aakar": "IRAM_Manpreet Kaur",
      "Client Name": "PGCIL",
      "State": null,
      "Place / City": "Raigarh, Chhattisgarh",
      "Name of Work": "“Construction of 2nos. of Outdoor Covered store buildings at POWER GRID, HVDC, Raigarh Station.” ",
      "PO/WO/LOA Details": "BLOA Ref. No. WR-I/C&M/SYE/NIT-82/2022-23/Rfx/LOA-816/704 Date 26-09-2023\n09 Months 26-09-2023 to 26-06-2024",
      "Financial Year": "2023-2024",
      "PO/WO/LOA Date": "2023-09-26",
      "Work Start Date": null,
      "Completion Date as per LOA/PO": "2024-12-26",
      "Latest Work Completion Date (as per Time Extension)": "2026-02-28",
      "Completion Date as per Finla Time Extension / Deviation": null,
      "Client Billing Address": "CGM, POWERGRID, Raigarh will be the Engineer-in-charge for th address of the Engineer -in-charge is as follows:\nChief General Manager\nPower Grid Corporation of India Ltd,\n11Km Milestone Nandeli Road, Village and PO: Kotra, Distt: Raigarh - 496001,\n(Chhattisgarh)\nSh. Praveen Kumar T V S, Mob; 8023093783.",
      "Name of Authorised Person At Client": "Sh. Praveen Kumar T V S, ",
      "Designation of Authorised Person At Client": "Engineers-In-Charge",
      "Mobile No. of Authorised Person At Client": "Mob; 8023093783.",
      "Email of Authorised Person At Client": null,
      "Email CC (Client)/C&M": "RHQ: \nsheejas@powergrid.in",
      "Contract Value Version as per LOI/NOA/LOA/DLOA/PO GST Extra": 13036492,
      "GST Extra /Including": null,
      "Updated Contract Value GST Extra": null,
      "Bank Guarantee Submitted / CPG Not Submitted": "Submitted ",
      "Bank Guarantee Value": "5469-04-07",
      "Bank Guaratee Expiry Date": "2025-03-31",
      "Bank Guaratee Expiry Date (Claim)": "2025-06-30",
      "Client WO/PO Upload LINK": "https://drive.google.com/file/d/15c61paAgeI1sJ7YGBplu8tzhn5QsIkEB/view?usp=sharing",
      "Client contract agreement LINK": "https://drive.google.com/file/d/1UFL-jCtCFAvDwenEFWzqp8PR0G6000t_/view?usp=sharing",
      "1st Sub Contractor's Name": "M/s PERFECT DESIGNING HUB",
      "Proprietor / Auth. Signatory of Sub-Cont.": "Mr. MOHAMMAD FAIJAN ",
      "Mobile No. of Sub-Cont. Proprietor / Auth. Signatory's": "7869091028, 7470858515",
      "Email of Sub-Cont. Proprietor / Auth. Signatory's": "pdh.tech.consulttancy@gmail.com",
      "GSTIN of Sub Contractor": "22ACCPF4621Q1ZQ",
      "WO on % Party": "05",
      "Work Order No.": "02-20036-224248\t",
      "Work Order Date": "2025-09-05",
      "Sub-Contractor Work Order (Upload)": "https://drive.google.com/file/d/18kTgiilTwM7kkXwLC5EytbuMB1_LJ79f/view?usp=sharing"
    },
    {
      "Current Status": "A5 | Works in Progress Appropriately",
      "Tender Ref. No. / NIT & Date": "NIT NO. : 9900264848/026/1019 Dated 12.09.2023\nYour Offer No. : Your offer received against our tender with NIT No.NTPC/USSC-CPG2/ 9900264848\nYour Reference : Bid opening date:25-10-2023\nOur Reference : NTPC/USSC-CPG2/9900264848/ 2023_NTPC_ 79144_1",
      "EMD/tender fee Online /Exempted as per MSME bidder": "EMD  1,00000/- \nUTR Number :  CPADDUNTW5 dt. 09/10/2023",
      "EMD /online payment received status": "Not received ",
      "HR required data for HR clearance RA bill realeased": null,
      "Policy Expired dt./renewal if any": null,
      "Labour License No./date of reg. & expired dt. /BOCW if any": null,
      "Status of PF/ESIC pending amount for HR clearance Running bills": null,
      "Job Allocation No. (JAN)": 20037,
      "EIC at Aakar": "Monika Kochhar",
      "Client Name": "NTPC",
      "State": "Odisha",
      "Place / City": "Darlipalli",
      "Name of Work": "Construction of toilet units along with drinking water facilities at different location at plant\narea of NTPC- Darlipali.",
      "PO/WO/LOA Details": "Purchase Order No. : 5500043565-026-1019 Date : 28.11.2023\nEMD online payment",
      "Financial Year": "2023-2024",
      "PO/WO/LOA Date": "2023-11-28",
      "Work Start Date": "10.12.2023",
      "Completion Date as per LOA/PO": "09.12.2024",
      "Latest Work Completion Date (as per Time Extension)": "2026-01-31",
      "Completion Date as per Finla Time Extension / Deviation": "NIL",
      "Client Billing Address": "NTPC Limited \n1053 Darlipali STPP\nP.O. Darlipali Odisha Sundargarh\nOdisha\n770072\nIndia\n07752-246552\n07752-246507\nInvoicing to be done on\nGST No. : 21AAACN0255D1ZA",
      "Name of Authorised Person At Client": "Kaushik Banerjee (EIC)\nMR.  Pankaj  Singh\n\nSh. R N Behera ",
      "Designation of Authorised Person At Client": "Sr. Manager \nAGM\nEngineers-In-Charge",
      "Mobile No. of Authorised Person At Client": "9435587000 \n96509 99820\n\n9435560613",
      "Email of Authorised Person At Client": "kaushikbanerjee@ntpc.co.in; ABHISHEKPRASAD@NTPC.CO.IN; PANKAJSINGH@NTPC.CO.IN",
      "Email CC (Client)/C&M": "manishkumar01@ntpc.co.in;'rnbehera@ntpc.co.in'; HRSINGH01@NTPC.CO.IN",
      "Contract Value Version as per LOI/NOA/LOA/DLOA/PO GST Extra": 8030237.67,
      "GST Extra /Including": null,
      "Updated Contract Value GST Extra": 803023.767,
      "Bank Guarantee Submitted / CPG Not Submitted": "CPG no. 0187625BG0B00127",
      "Bank Guarantee Value": 160605,
      "Bank Guaratee Expiry Date": "31-10-2025 to 01-05-2027\n",
      "Bank Guaratee Expiry Date (Claim)": "2028-05-01",
      "Client WO/PO Upload LINK": "https://drive.google.com/file/d/1hcMrYZ0T0o1G4Zm1qbPO11n54nZ7tfxh/view?usp=sharing",
      "Client contract agreement LINK": "https://drive.google.com/file/d/1sLccB2M23nLhIqgofyRnE1HrTBXroYtM/view?usp=sharing",
      "1st Sub Contractor's Name": "M/s  Shri Shyam Baba Infratech ",
      "Proprietor / Auth. Signatory of Sub-Cont.": "AVINASH KEDIA",
      "Mobile No. of Sub-Cont. Proprietor / Auth. Signatory's": "\n8827955000",
      "Email of Sub-Cont. Proprietor / Auth. Signatory's": "gsharma2060@yahoo.com  , \navinashkedia675@gmail.com",
      "GSTIN of Sub Contractor": "\n22BODPK0495R1ZK",
      "WO on % Party": 0.06,
      "Work Order No.": "20037-224237",
      "Work Order Date": "2024-07-18",
      "Sub-Contractor Work Order (Upload)": "https://drive.google.com/file/d/1fUEHOOnJtoPh0cBmOwaoL3tcj6qAAHdF/view?usp=sharing"
    },
    {
      "Current Status": "A5 | Works in Progress Appropriately",
      "Tender Ref. No. / NIT & Date": "Specification No.: ODP/BB/C&M-3428/OT-15/RFx No. 5002002975/23-24\nIntegrity Pact Required - No\nPrice Opening Date: 12.02.2024 18:32:00",
      "EMD/tender fee Online /Exempted as per MSME bidder": "Submitted",
      "EMD /online payment received status": null,
      "HR required data for HR clearance RA bill realeased": null,
      "Policy Expired dt./renewal if any": null,
      "Labour License No./date of reg. & expired dt. /BOCW if any": null,
      "Status of PF/ESIC pending amount for HR clearance Running bills": null,
      "Job Allocation No. (JAN)": 20039,
      "EIC at Aakar": "IRAM ",
      "Client Name": "PGCIL",
      "State": null,
      "Place / City": "Jeypore Sub-Station, Odisha",
      "Name of Work": "Package: Demolishing Existing Foundations, Excavation, and construction of New 500 MVA Transformer & other required equipment Foundation, and disposal of malba/unserviceable waste at POWERGRID, Jeypore Sub-Station (Under ADD-CAP 2019-24)”.",
      "PO/WO/LOA Details": "LOA Ref. No. : ODP/BB/C&M-3428/OT-15/LOA-210/23-24 dt 14-02-2024\nSAP PO: 4100006109\n02 Months i.e 14-02-2024 to 14-04-2024",
      "Financial Year": "2023-2024",
      "PO/WO/LOA Date": "2024-02-14",
      "Work Start Date": null,
      "Completion Date as per LOA/PO": "2024-04-14",
      "Latest Work Completion Date (as per Time Extension)": "2025-12-31",
      "Completion Date as per Finla Time Extension / Deviation": null,
      "Client Billing Address": "ENGINEER-IN-CHARGE:\n\nSr. General Manager,\nPower Grid Corporation of India Ltd., 400/220KV Jeypore Sub-Station PO- Kaliagaon, Jeypore, Odisha-764002 Mob. No.- 9437022035 or his authorized representative.",
      "Name of Authorised Person At Client": "Naveen Kumar , \n\nSiva Behara, \n\n \n",
      "Designation of Authorised Person At Client": "Dy. Manager (Asset Management), \n\nDy. Manager ",
      "Mobile No. of Authorised Person At Client": "9437022035, +91 77528 46266\n\n Mobile: 9052331230 ",
      "Email of Authorised Person At Client": "naveen.kumar@powergrid.in\n\nsiva5313@powergrid.in\n\ntejprakashsahu@powergrid.in\n\nd.suresh_reddy@powergrid.in",
      "Email CC (Client)/C&M": "cnmodisha@powergrid.in",
      "Contract Value Version as per LOI/NOA/LOA/DLOA/PO GST Extra": 7413479,
      "GST Extra /Including": "GST 18% Extra",
      "Updated Contract Value GST Extra": null,
      "Bank Guarantee Submitted / CPG Not Submitted": "Submit",
      "Bank Guarantee Value": "3929-09-27",
      "Bank Guaratee Expiry Date": "2025-09-20",
      "Bank Guaratee Expiry Date (Claim)": "2025-12-31",
      "Client WO/PO Upload LINK": "https://drive.google.com/file/d/1PXO4v5Aqz6aVIbQYrUrfnXu887oxFq9W/view?usp=drive_link",
      "Client contract agreement LINK": "https://drive.google.com/file/d/1gs86QyT5hmWiHCjS2A0iAxpWDdFURfiT/view?usp=sharing",
      "1st Sub Contractor's Name": "AIEPL",
      "Proprietor / Auth. Signatory of Sub-Cont.": null,
      "Mobile No. of Sub-Cont. Proprietor / Auth. Signatory's": null,
      "Email of Sub-Cont. Proprietor / Auth. Signatory's": null,
      "GSTIN of Sub Contractor": null,
      "WO on % Party": null,
      "Work Order No.": null,
      "Work Order Date": null,
      "Sub-Contractor Work Order (Upload)": null
    },
    {
      "Current Status": "A5 | Works in Progress Appropriately",
      "Tender Ref. No. / NIT & Date": "Tender Ref No. :  NTPC/USSC-CPG2/9900284682\nTender ID :  2024_NTPC_88844_1\nTender Title :  Construction of CISF Barrack at Kalwari, NTPC - Kanti\nBid Start Date & Time : 23-Jul-2024 06:00 PM\nBid End Date & Time : 02-Aug-2024 03:00 PM",
      "EMD/tender fee Online /Exempted as per MSME bidder": "50000/-\nUTR Number: IGARQDGWE1\n20/08/2024",
      "EMD /online payment received status": "Not received ",
      "HR required data for HR clearance RA bill realeased": null,
      "Policy Expired dt./renewal if any": null,
      "Labour License No./date of reg. & expired dt. /BOCW if any": null,
      "Status of PF/ESIC pending amount for HR clearance Running bills": null,
      "Job Allocation No. (JAN)": 20043,
      "EIC at Aakar": "Monika Kochhar",
      "Client Name": "NTPC",
      "State": "Bihar",
      "Place / City": "Kanti",
      "Name of Work": "CONSTRUCTION OF CISF BARRACK AT\nKALWARI, NTPC – KANTI.",
      "PO/WO/LOA Details": "EMD online payment \nPurchase Order No. : 5500045392-025-1019 Date : 30.09.2024 (\nPurchase Order No. : 5500045392-025-1019 Date : 30.09.2024 ( version : 1 Date : 02.05.2025 )",
      "Financial Year": "2024-2025",
      "PO/WO/LOA Date": "30.09.2024",
      "Work Start Date": "16.10.2024\nActual .....\n17/06/2025",
      "Completion Date as per LOA/PO": "15.04.2025",
      "Latest Work Completion Date (as per Time Extension)": "2026-03-31",
      "Completion Date as per Finla Time Extension / Deviation": "NIL",
      "Client Billing Address": "NTPC Limited \n1087 Muzaffarpur Thermal Power Station \nPO Kanti, Distt. Muzaffarpur Muzaffarpur\nBihar\n843130\nIndia\n07752-246552\n07752-246507",
      "Name of Authorised Person At Client": "Vikash Kumar Jaiswal\nRaj Kumar \n\nRas Bihari Mandal\n",
      "Designation of Authorised Person At Client": "DGM (Civil)\n CCD DGM \nAGM(P)",
      "Mobile No. of Authorised Person At Client": "9425178449\n80049 47089",
      "Email of Authorised Person At Client": "VKJAISWAL03@NTPC.CO.IN\nRAJKUMAR02@NTPC.CO.IN\nRBMANDAL@NTPC.CO.IN>",
      "Email CC (Client)/C&M": "anujsharma@ntpc.co.in;mtansari@ntpc.co.in",
      "Contract Value Version as per LOI/NOA/LOA/DLOA/PO GST Extra": 4389743.15,
      "GST Extra /Including": "18% Extra",
      "Updated Contract Value GST Extra": null,
      "Bank Guarantee Submitted / CPG Not Submitted": "0187625BG0B00018\n17/01/2025",
      "Bank Guarantee Value": 400000,
      "Bank Guaratee Expiry Date": "Date of Expiry :- 15-07-2025\nDate of Claim :- 15-10-2025\nDate of Expiry:- 15-01-2026\nDt. Of Claim :- 15-04-2026",
      "Bank Guaratee Expiry Date (Claim)": "2026-04-15",
      "Client WO/PO Upload LINK": "https://drive.google.com/file/d/183aQ6wVSPQFjDA6bAz3TChRX8Cxg3zJF/view?usp=sharing",
      "Client contract agreement LINK": "https://drive.google.com/file/d/1G8UeYXt2ltLuLp9GVAAPBLtEM3ACdTdj/view?usp=sharing",
      "1st Sub Contractor's Name": "M/S RITIKA ENGICON PRIVATE LIMITED",
      "Proprietor / Auth. Signatory of Sub-Cont.": "Ritesh Kumar",
      "Mobile No. of Sub-Cont. Proprietor / Auth. Signatory's": 9113166835,
      "Email of Sub-Cont. Proprietor / Auth. Signatory's": "guptaritesh517@gmail.com",
      "GSTIN of Sub Contractor": "10AANCR7697G1ZY",
      "WO on % Party": "8.5%",
      "Work Order No.": "02-20043-12520003",
      "Work Order Date": "2025-04-04",
      "Sub-Contractor Work Order (Upload)": "https://drive.google.com/file/d/1a4R752VRroui7zHIU1EkCx5ggpcCMuoh/view?usp=sharing"
    },
    {
      "Current Status": "A5 | Works in Progress Appropriately",
      "Tender Ref. No. / NIT & Date": " L1 \nGEM/2024/B/5177254 \nNTPC/USSC–CPG1/9900284701",
      "EMD/tender fee Online /Exempted as per MSME bidder": "Exempted ",
      "EMD /online payment received status": null,
